year,country_id,country,performer,song,place_contest,sf_num,running_final,running_sf,place_final,points_final,place_sf,points_sf,points_tele_final,points_jury_final,points_tele_sf,points_jury_sf,composers,lyricists,lyrics,youtube_url,youtube_url_studio,start

2011,az,Azerbaijan,Ell & Nikki,Running Scared,1,1.0,19.0,18.0,1.0,221.0,2.0,122.0,,,,,Iain Farquharson;Sandra Bjurman;Stefan Örn,Sandra Bjurman;Stefan Örn,"Oh oh, oh... oh, oh... oh, oh...\nOh oh, oh... oh, oh... oh, oh...\n\nCome to me, come to me tonight\nOh God, I need you, anyway\nBaby, I just wanna be, be around you all the time\nOh God, I need you, oh...\n\nI'm running, I'm scared tonight\nI'm running, I'm scared of life\nI'm running, I'm scared of breathing\n'Cause I adore you\n\nI'm running, I'm scared tonight\nI'm running, I'm scared of breathing\n'Cause I adore you\n\nCome to me, come to me a bit more\nOh God, I need you\nThere's nothing left for me to say\n\nSo rest on me darling, stay forever more\nOh God, I need you, I need you\n\nI'm running, I'm scared tonight\nI'm running, I'm scared of life\nI'm running, I'm scared of breathing\n'Cause I adore you\n\nI'm running, I'm scared tonight\nI'm running, I'm scared of breathing\n'Cause I adore you\n\nOh, what I wouldn't give away\nTo be your shelter and keep you safe\nKeep you safe\n\nI'm running, I'm scared tonight\nI'm running, I'm scared of life\nI'm running, I'm scared of breathing\n'Cause I adore you\n\nI'm running, I'm scared tonight\nI'm running, I'm scared of breathing\n'Cause I adore you\n\nAnd I'm running\nAnd I'm running scared\n'Cause I adore you",https://youtube.com/watch?v=_0tlQUW5X0U,https://www.youtube.com/watch?v=eG2uNbNRkAw,00:00:51
2011,it,Italy,Raphael Gualazzi,Madness Of Love,2,,12.0,,2.0,189.0,,,,,,,Raphael Gualazzi,,"Dire si, dire mai non è facile, sai\nAnd all the world around you seems to slip and disappear\nIo non so più chi sei, non mi importa chi sei\nI know for certain I won't bother you with nostalgia\n\nMa vedrai un altro me in un sogno fragile\nRiderai come se non ti avessi amato mai\nCercherai un altro me oltre l'ombra di un caffè\nTroverai solo me\nSe mi fermo un attimo, io non so più chi sei\n\nQui si vive così, day by day, night by night\nBut someone hit me and I fell into your heart, my dear\nAnd you'll fly over lands where your eyes can't find the end\nUp on mountains, down lanes\nBeing so far away from you just makes me feel so damned\n\nE vedrai un'altra te, quasi invincibile\nViva come non mai ed è li che tu mi avrai\nOltre false magie l'orizzonte sarai\nSplenderai, splenderai, splenderai, splenderai",https://youtube.com/watch?v=TE0uNLp3LuU,https://www.youtube.com/watch?v=q6Hz3MxthYI,00:00:39
2011,se,Sweden,Eric Saade,Popular,3,2.0,7.0,8.0,3.0,185.0,1.0,155.0,,,,,Fredrik Kempe,,"Stop, don't say that it's impossible\n'Cause I know it's possible\nThough I know you never look my way\nI can say you will one day\nI can say you will one day\n\nI will be popular, I will be popular\nI'm gonna get there, popular\nMy body wants you, girl\nMy body wants you, girl\nI'll get you when I'm popular\n\nI put my hands up in the light\nYou see me dancing for my life\nI will be popular, I will be popular\nI'm gonna get there, popular\n\nSpread the news, I'm gonna take the fight\nFor the spotlight, day and night\nI can take this to the number one\nBe someone before you're gone\nBe someone before you're gone\n\nI will be popular, I will be popular\nI'm gonna get there, popular\nMy body wants you girl\nMy body wants you girl\nI'll get you when I'm popular\n\nI put my hands up in the light\nYou see me dancing for my life\nI will be popular, I will be popular\nI'm gonna get there, popular\n\nOh pop... oh pop... oh popular\nOh pop... oh pop... oh popular\nOh pop... oh pop... oh popular\nOh, oh...\n\nI will be popular, I will be popular\nI'm gonna get there\nMy body wants you, girl\nMy body wants you, girl\nI'll get you when I'm popular\n\nI put my hands up in the light\nYou see me dancing for my life\nI will be popular, I will be popular\nPopular\n\nOh pop... oh pop... oh popular\nOh, oh...",https://youtube.com/watch?v=-04pUETT7oI,https://www.youtube.com/watch?v=sjB2lKSkstk,00:00:36
2011,ua,Ukraine,Mika Newton,Angel,4,2.0,23.0,6.0,4.0,159.0,6.0,81.0,,,,,Maryna Skomorohova,Ruslan Kvinta,"When you look into my eyes\nWorld becomes a better place\nAnd you know deep inside\nLove is taking all the space\nBaby, I love you... and you?\n\nWe are birds, we fly so high and we are falling down\nWhen I dream of you, my dream is so fearless\nWe are people of the planet, we live human lives\nWe are angels, we're in danger, we are crystal white, crystal white\n\nWhen you look into my eyes\nSun is touching mountain top\nWhen you look into my eyes\nIt will never have to stop\nBaby, I love you... and you?\n\nWe are birds, we fly so high and we are falling down\nWhen I dream of you, my dream is so fearless\nWe are people of the planet, we live human lives\nWe are angels, we're in danger, we are crystal white, crystal white\n\nWe are birds, we fly so high and we are falling down\nWhen I dream of you, my dream is so fearless\nWe are people of the planet, we live human lives\nWe are angels, we're in danger, we are crystal white, crystal white",https://youtube.com/watch?v=g_xRmEkR6KE,https://www.youtube.com/watch?v=Jtfetx1u8I0,00:00:46
2011,dk,Denmark,A Friend In London,New Tomorrow,5,2.0,3.0,18.0,5.0,134.0,2.0,135.0,,,,,Jakob Glæsner;Lise Cabble,,"Come on boys, come on girls\nIn this crazy, crazy world\nYou're the diamonds, you're the pearls\nLet's make a new tomorrow, today\n\nWake up, slow down\nDo nothing right now\nBreathe in, breathe out\nDid we forget how to live, to dream\nAnd what it all means?\nIt's like we don't care\n\nWho's hot, who's not?\nWho's got the right upside down?\nTonight, tomorrow\nYou're out of time\nUpstyle, you are back in the line\nA race to nowhere\n\nCome on boys, come on girls\nIn this crazy, crazy world\nYou're the diamonds, you're the pearls\nLet's make a new tomorrow\n\nCome on girls, come on boys\nIt's your future, it's your choice\nAnd your weapon is your voice\nLet's make a new tomorrow, today\n\nTurn left, turn right\nDon't make up your mind\nYour way to fame is all in vain\nYou get in the spot\nThen you run out of luck\nYou're going nowhere\nWe can change it all today\n\nCome on boys, come on girls\nIn this crazy, crazy world\nYou're the diamonds, you're the pearls\nLet's make a new tomorrow\n\nCome on girls, come on boys\nIt's your future, it's your choice\nAnd your weapon is your voice\nLet's make a new tomorrow, today\n\nCome on boys\nLet's make a new tomorrow\n\nCome on boys, come on girls\nIn this crazy, crazy world\nYou're the diamonds, you're the pearls\nLet's make a new tomorrow\n\nCome on girls, come on boys\nIt's your future, it's your choice\nAnd your weapon is your voice\nLet's make a new tomorrow, today",https://youtube.com/watch?v=YDXeK0r3aKs,https://www.youtube.com/watch?v=W0HiLPWlhZY,00:00:48
2011,ba,Bosnia & Herzegovina,Dino Merlin,Love In Rewind,6,2.0,2.0,1.0,6.0,125.0,5.0,109.0,,,,,Dino Merlin,,"Oh... (Oh...)\n\nOne to a hundred, multiplied by you\nIt all looks great, it all looks cool\nHealthy children go to school\nMy daughter's in love, my son loves too\n\nOh, on the surface, oh, in the distance\nIt's all the same\nOh, in the darkness, oh, don't you notice\nWhat a different game\n\nIf you take this life from me today\nTear it up and bury me away\n\nYou'll just find two, three songs of mine\nHundred worries of mine\nYour love, your love in rewind\nYou'll just find two, three songs of mine\nHundred worries of mine\nAnd all your love in rewind\n\nSito, oh...\nSito, oh...\nSito, oh...\nSito, oh...\n\nOne to a hundred, multiplied by two\nIt's less about me, it's less about you\nWe keep on running from certainty\nBut don't know where to run from reality\n\nIf you take this life from me today\nTear it up and bury me away\n\nYou'll just find two, three songs of mine\nHundred worries of mine\nYour love, your love in rewind\nYou'll just find two, three songs of mine\nHundred worries of mine\nAnd all your love, your love\n\n(Kad se moj život malo prosije) Your love, ooh.. ooh...\n(Pa na vrhu ostane najkrupnije) Oh... oh... oh... oh...\nEh hey.....",https://youtube.com/watch?v=mBg3coarF_8,https://www.youtube.com/watch?v=z5tObhnWSjE,00:00:50
2011,gr,Greece,Loucas Yiorkas feat. Stereo Mike,Watch My Dance,7,1.0,9.0,19.0,7.0,120.0,1.0,133.0,,,,,Eleana Vrahali;Giannis Christodoulopoulos,,"I was born so betrayed – who am I, what I'll be?\nWhat is mine in this life? Just the heaven and sea\nNo, I won't give them up, they're my fortune, my proof\nDon't believe what you hear 'cause the truth kills your truth\nThe duty I've got is my war against fear\nAnd I want you with me, yes, I want you so near\n\nWatch my dance, head up high, hands like wings and I'll fly\nTo kefali psila ke ta herya anihta\n\nTin ehi i psihi mu ti fotya\nTus fovus olus kei monadhika\nTa vimata mu kano os to Theo\nKi an peso ego xana tha sikotho\n\nI have heard many words, but I still won't forget\nThe language of my body, the sound my heart makes\nSo I'm staying alive and my losses won't let\nMy soul to surrender, the power of loss is my bet\n\nWatch my dance, head up high, hands like wings and I'll fly\nTo kefali psila ke ta herya anihta\n\nTin ehi i psihi mu ti fotya\nTus fovus olus kei monadhika\nTa vimata mu kano os to Theo\nKi an peso ego xana tha sikotho\n\nTin ehi i psihi mu ti fotya\nTus fovus olus kei monadhika\nTa vimata mu kano os to Theo\nKi an peso ego xana tha sikotho",https://youtube.com/watch?v=FdZzklXoAOg,https://www.youtube.com/watch?v=BP_ctL9DJH4,00:00:46
2011,ie,Ireland,Jedward,Lipstick,8,2.0,6.0,19.0,8.0,119.0,8.0,68.0,,,,,Dan Priddy;Lars Halvor Jensen;Martin Larson,,"You say you're on it, but you just don't know\nYou're spending money like you're on death row\nYou must be mis-educated by all the guys that you dated\nYou think I'll take the bait, but I don't think so\n\nOh... am I headed for a car crash?\nOh... I'm just about to meet my match, she takes the\nHo... I'm about to fall in, head first\nSisters, let me tell you how it works\nHey!\n\nShe's got her lipstick on\nHere I come, da da dum\nShe's got her lipstick on\nHit and run, then I'm gone\nCheck my collar, collar, hey, hey hey...\nCheck my collar, collar, hey, hey hey...\n\nOh... oh...\n\nYou look at me and I got you in mind\nI come on over, see what I could find\nNo appetite for delusion\nHow could I win when I'm losin'?\nYou're saying yes, when it is no, no, no, no\n\nOh... am I headed for a car crash?\nOh... I'm just about to meet my match, she takes the\nHo... I'm about to fall in, head first\nSisters, let me tell you how it works\nHey!\n\nShe's got her lipstick on\nHere I come, da da dum\nShe's got her lipstick on\nHit and run, then I'm gone\nCheck my collar, collar, hey, hey hey...\nCheck my collar, collar, hey, hey hey...\n\nShe's got her lipstick on\nHere I come, da da dum\nShe's got her lipstick on\nHit and run, then I'm gone\nCheck my collar, collar, hey, hey hey...\nCheck my collar, collar, hey\n\nIt's not that I don't wanna play (play, play)\nAnd then I didn't look your way (way, way)\nIt's not like every girl's the same (same, same)\nYou gotta know just how to treat this miss\nShe won't be dismissed\nHey...\n\nShe's got her lipstick on\nHere I come, da da dum\nShe's got her lipstick on\nHit and run, then I'm gone\nCheck my collar, collar, hey, hey hey...\nCheck my collar, collar, hey, hey hey...\n\nShe's got her lipstick on\nHere I come, da da dum\nShe's got her lipstick on\nHit and run, then I'm gone\nCheck my collar, collar, hey, hey hey...\nCheck my collar, collar, hey, hey hey...\n\nHere I come, here I come\nDum da dum, da dum, da dum...\nHere I come, here I come\nDum da dum, da dum, da dum...\n\nHit and run, hit and run\nDum da dum, da dum, da dum...\nThen I'm gone, then I'm gone\nGone, gone, gone, gone",https://youtube.com/watch?v=XgrlG6hQbNM,https://youtube.com/watch?v=6x77sOUQhZU,00:00:38
2011,ge,Georgia,Eldrine,One More Day,9,1.0,25.0,9.0,9.0,110.0,6.0,74.0,,,,,DJ BE$$,DJ Rock;Miken,"After the day I met you there, I'm not the same\nI try to sleep, but nothing helps me to feel insane\nPassion game that I'll play gonna last one more day\nOne more night I'll be there in my dreams again and again\n\nI wanna give it on fire, uncover vicious desire\nAbandon painful denial, find pretty reason to stay\nOne more forbidden sensation, one more emotional flare\nDown with the fake hesitation, hell yeah, I'm ready to pay\n\nPay for the hopeless despair\nGonna live one more day of my fate\n\nHere I am standing with my determination\nRemember when I used to be one of those silly fellows kind of 'really don't care'\nAnd I realised all my thoughts and all my fears around me\nYou wanted to know what I felt and you got it right there\n\nTurn around, all the words of regrets\nAnd seize the chance to find the way so I can be raised\nI am lame, psycho from the brain,\nThere is nothing I can do, that's the part of the game\n\nOut of such foolish state, it's gonna find no other way\n(Make way 'cause it's all about the shame)\nFeel no shame, 'cause I live one more day again\n\nI wanna give it on fire, uncover vicious desire\nAbandon painful denial, find pretty reason to stay\nOne more forbidden sensation, one more emotional flare\nDown with the fake hesitation, hell yeah, I'm ready to pay\n\nPay for the hopeless despair\n(Turn back in the days when you desired and craved)\n(And all the way you felt just like you're burned in the flames)\nGonna live one more day of my fate\n(No shame, no way, no play, no brain, no game)\n\nI wanna give it on fire, uncover vicious desire\nAbandon painful denial, find pretty reason to stay\nOne more forbidden sensation, one more emotional flare\nDown with the fake hesitation, hell yeah, I'm ready to pay\n\nPay for the hopeless despair\nGonna live one more day of my fate",https://youtube.com/watch?v=CfJVlssy0cc,https://www.youtube.com/watch?v=aFV0Tcy9OXc,00:00:37
2011,de,Germany,Lena,Taken By A Stranger,10,,16.0,,10.0,107.0,,,,,,,Gus Seyffert;Monica Birkenes;Nicole Morier,,"She's got a knuckle in her eye\nHe knows her catcall\nCan't escape from telling lies\nI heard her sayin':\n\n""Hey, mind if I take this chair?""\n""Hey, mind if I take this chair?""\n\nHe drops a pause\nShe looks annoyed\nBut she's so mean\nHe thinks she has to be the one\n\nTaken by a stranger\nStranger things are startin' to begin\nLured into the danger\nTrip me up and spin me round again\n\nYou got some coffee on your collar\nAnd you forgot to comb your hair\nI can't wait till I do better\nYou're here and I don't care\nCan't help it if you like it 'cause I won't be here tomorrow\nNo one ever told you that you wouldn't be rejected\n\nTaken by a stranger\nStranger things are startin' to begin\nLured into the danger (Danger is a risky business)\nTrip me up and spin me round again\n\nDada dada dada da...\nOoh... la la la la la...\n\nTaken by a stranger\nStranger things are startin' to begin\nLured into the danger (Danger is a risky business)\nTrip me up and spin me round again",https://youtube.com/watch?v=KqZprvpWlcE,https://www.youtube.com/watch?v=QhCXcqHPJfg,00:00:51
2011,gb,United Kingdom,Blue,I Can,11,,14.0,,11.0,100.0,,,,,,,Ben Collier;Ciaron Bell;Duncan James;Ian Hope;Lee Ryan;Liam Keenan,,"(Ge-ge-ge-get back up again)\n(Ge-ge-ge-get back up again)\n\nYou were the eyes in the face of fortune \nI lost my way and I couldn't find you\n Oh… oh no\n\nWe're not the first ones to be divided\n Won't be the last to be reunited\n Oh… oh no\n\nIt's like rain fallin' down \nDrops of pain hit the ground\n I can't speak, there's no sound when you're gone\n (Yeah, yeah, come on)\n\nI can, I will \nI know I can untie these hands \nGe-ge-ge-get back up again\n I can, I will \nI know I can untie these hands \nGe-ge-ge-get back up again\n\nI can, oh\nI can\n (Get back up again)\n\nI've never lost anything quite like this \nNo second chances if I don't find it \nNo, oh no, no\n\nYou closed the door and you kept on walkin'\n Left me behind and there's no more talkin'\n No , oh no (Oh no)\n\nIt's like rain fallin' down\n Drops of pain hit the ground\n I can't speak, there's no sound when you're gone \n\nI can, I will \nI know I can untie these hands\n Ge-ge-ge-get back up again \n\nI can, I will\n I know I can untie these hands\n Ge-ge-ge-get back up again\n(Come on)\n\nI can, oh\n I can\n (Get back up again)\n\nWe're not the first ones to be divided, oh \nWon't be the last to be reunited, no\n(Come again, one more time) \nWhen you're gone\n(Come on)\n\nI can, I will\n I know I can untie these hands\n Ge-ge-ge-get back up again\n I can, I will \nI know I can untie these hands\n Ge-ge-ge-get back up again\n\nI can, I can\nGe-ge-ge-get back up again",https://youtube.com/watch?v=y1dXMWWq6y8,https://www.youtube.com/watch?v=hPuDbaOBDsc,00:00:40
2011,md,Moldova,Zdob și Zdub,So Lucky,12,2.0,15.0,7.0,12.0,97.0,10.0,54.0,,,,,Marc Elsner;Mihai Gîncu;Roman Iagupov,Andy Shuman;Marc Elsner,"So lucky, so lucky\n\nFlashes, ray ban glasses\nI move with ease in my convertible breeze (So lucky)\nMartini, whiskey on the rocks\nLife on the top, my party never stops (So lucky)\n\nWinner, a dusk to dawn sinner\nLove traded in for lust, it's emotions I don't trust (So lucky)\nOn top, the cream of the crop\nYou know I love to rock, the fun will never stop (So lucky)\n\nYou see, it's all about me\nThe servants and the king, I'm the ruler of the world (So lucky)\nA tug, she pulls me like a drug\nI want her on the rug, but she's not that kind of girl (So lucky)\n\nI see you where the lights glow\nYou pull me in your private side show\nAnd now I see your moves in slo-mo\nI try to kiss you, but you slip away\n\nYet you never walk away from me\nAre you a shadow of what might be?\nWhy should one woman stand above the rest?\nThere is a mystery to you deep beneath the flesh\n\n(So lucky, so lucky, so lucky, so lucky)\n\nThose eyes pulling me in, a body made to sin\nBut I can not win  (So lucky)\nWait, I'm ready at the gate, don't tell me it's too late\nHer fire starts to melt my heart (So lucky)\n\nShe's clean, not part of any scene\nShe's more like a dream I don't want to wake up from (So lucky)\nI see, she's somehow changing me\nShe's where I want to be, can't stand a moment without her (So lucky)\nAnymore\n\nI see you where the lights glow\nYou pull me in your private side show\nAnd now I see your moves in slo-mo\nI try to kiss you, but you slip away\n\nYet you never walk away from me\nAre you a shadow of what might be?\nWhy should one woman stand above the rest?\nThere is a mystery to you deep beneath the flesh\n\nSo lucky!",https://youtube.com/watch?v=nHAY_OVN_gY,https://www.youtube.com/watch?v=2fZir3asWtE,00:00:20
2011,si,Slovenia,Maja Keuc,No One,13,2.0,20.0,13.0,13.0,96.0,3.0,112.0,,,,,Matjaž Vlašič,Urša Vlašič,"And you came to me one night\nLike a morning light\nJust to hold me tight\nThen you left and I was so alone\nSaying I should have known\nYou're no good for me\n\nThere's no reason I should cry\nNo, no baby, I'll survive\nI don't care, I don't care\n\nNo one will ever hold you tight\nNo one will ever love you like\nJust no one like I do\nThere is no one, no one\n\nNo one will ever treat you right\nYou're the one who's never satisfied\nThere is no one like I, like I am\n\nI can feel what you're looking for\nI'm not that girl no more\nI'm not made of stone\nI'm gonna stand on my own\nNot gonna break me down\nNo one will stop me now\n\nNo... no no no no no...\n'Cause life is kind without you\nAnd I know I can make it through without you\n\n(Life goes all around)\nRound and round and round\nI feel love for sure\n(And it's gonna get you)\n\n(Life goes all around)\nSpinning all around\nNow you want me, don't you?\n\nNo one will ever hold you tight (Hold you tight)\nNo one will ever love you like (Love you like)\nNow you're back, I can feel your love\nOh yeah, I'm never gonna let you\n\nNo one will ever treat you right (Treat you right)\nYou're the one who's never satisfied (Satisfied)\nAfter all, you can fall\nAnd there is no one you can reach to\n\nNo one will ever, ever love you\nNo one will ever, ever touch you\nNo one will ever, ever hold\nTurn around now, just turn around now\nIf you love me, yeah\nNo one like me, no one, no one",https://youtube.com/watch?v=NNP3nfvoqps,https://www.youtube.com/watch?v=7pn2fDEGyKk,00:00:53
2011,rs,Serbia,Nina,Čaroban,14,1.0,24.0,6.0,14.0,85.0,8.0,67.0,,,,,Kristina Kovač,,"Ciča zima i svud je prokleti led\nBaš sam imala težak dan\nLjudi čudni su, niko ne zna za red\nKući vučem se umorna\n\nI dok kopam po tašni da pronađem ključ\nVeć na ivici nerava\nMoje sunce, moj mesec i zvezdice sve\nMoj muškarac mi otvara\nMoj je čovek na vratima\n\nI istog trena vredim kao hiljadu žena\nJer njemu sam lepa i jaka ko stena\nI kad me grli, znam da sve je u redu\nČovek je čaroban\n\nSve moje mrakove u proleće boji\nOd kad me voli ja uspravno stojim\nI njemu ja sam dobra, baš kakva jesam\nČovek je čaroban\n\nZbogom tugo i zdravo osmehu moj\nSreća s njim se doselila\nTako topao, nežan i predivno svoj\nSamo meni on pripada\n\nDugo pričamo, moj je najbolji drug\nS njim se smejem ko blesava\nLjudi mi kažu nisu videli par koji tako isijava\nNaša ljubav je zarazna\n\nSada znam da vredim kao hiljadu žena\nJer njemu sam lepa i jaka ko stena\nI kad me grli, znam da sve je u redu\nČovek je čaroban\n\nSve moje mrakove u proleće boji\nOd kad me voli ja uspravno stojim\nI njemu ja sam dobra, baš kakva jesam\nČovek je čaroban\n\nSada znam (da vredim kao hiljadu žena)\n(I kad me grli, znam da sve je u redu)\nČovek je čaroban\n\nSve moje mrakove u proleće boji\nOd kad me voli ja uspravno stojim\nI njemu ja sam dobra, baš kakva jesam\nČovek je čaroban",https://youtube.com/watch?v=-CWvXKxjCs8,https://www.youtube.com/watch?v=YLPCMrkPDGg,00:00:34
2011,fr,France,Amaury Vassili,Sognu,15,,11.0,,15.0,82.0,,,,,,,Daniel Moyne;Quentin Bachelet,Jean-Pierre Marcellesi;Julie Miller,"Sognu di ste labbre\nDi sta voce chjara è pura\nMai spent'u ricordu di tè\nQuella notte quì cun mè\n\nSognu, mi lamentu\nU mio core, n'hà primura\nDi a vita, aspettu dumane\nInvinuchjatu ver di u mare\n\nSpart'u mondu cun tè\nMa tù, ti ne voli andà\nCantu per a vittoria\nLuntanu da tè, pensu sempre chè\nSei vicinu a mè, sognu di tè\n\nCanteraghju, canteraghju à tè\nA canzona, l'ohimè\n\nPiengu è sò male\nPreg'u celu fin'à more\nQuì da i monti, quì di front'à tè\nEsceraghju d'issu so...\n\nS'è tu mori, eu dinò",https://youtube.com/watch?v=OTiBNPT-x_Y,https://www.youtube.com/watch?v=uEb7hRo-Qyk,00:00:45
2011,ru,Russia,Alexej Vorobjov,Get You,16,1.0,10.0,7.0,16.0,77.0,9.0,64.0,,,,,AJ Junior;Alex Sparrow;Bilal 'The Chef';Eric Sanicola;RedOne,,"I choose my words like wise men do\nAnd tonight I'll get you right\nI rule my world like great men do\nAnd I fight, I fight for mine\n\nAnd you look so good on the floor\nPut my mind in a dirty zone\nIf they watch, let them watch\nNot losing you tonight\n\nOh oh... I'm coming to get you\nOh oh... I'm running, I'm gunning for you\nOh oh... I'm gonna get you\nI know you, you want me to\n\nI lost my mind somewhere between your face\nAnd your perfect shape\nI found a pleasure watching you having fun\nFooling around\n\nAnd you look so good on the floor\nPut my mind in a dirty zone\nIf they talk, let them talk\nNot losing you tonight\n\nOh oh... I'm coming to get you\nOh oh... I'm running, I'm gunning for you\nOh oh... I'm gonna get you\nI know you, you want me to\n\nGirl, you blow me away, want you here with me\nGirl, you blow me away, I want you to stay, yeah yeah\n\nOh oh oh... oh oh yeah... oh oh oh...\nI know you want me to\n\nOh oh... I'm coming to get you\nOh oh... I'm running, I'm gunning for you\nOh oh... I'm gonna get you\nI know you, you want me to, yeah",https://youtube.com/watch?v=C-3ohaRN3MM,https://www.youtube.com/watch?v=cLdnYUqY5Qw,00:00:39
2011,ro,Romania,Hotel FM,Change,17,2.0,17.0,14.0,17.0,77.0,4.0,111.0,,,,,Gabriel Băruţă,Alexandra Ivan;Gabriel Băruţă,"You think you've got the time to figure it out\nLife will pass you by, your time is running out, oh yeah\nYou're haunted by your troubles every day\nWasting smiles away, what's there left to say?\n\nYou gotta make believe and make your dreams come true\nIt ain't that hard to do, whoa...\n\n‘Cause I can't change, I can't change the world alone\nI need you all, everybody, start dreaming of it\nAnd take your step that's gonna make a difference\nAnd change your world\n‘Cause I can't change the world alone\nI need you all, everybody, start dreaming of it\nAnd take your step that's gonna make a difference\nAnd change your world\n\nStrangest places that you just wanna hide\nWon't you turn the tide? A smile can change it all\nYou gotta make believe and make your dreams come true\nIt ain't that hard to do, whoa...\n\n‘Cause I can't change, I can't change the world alone\nI need you all, everybody, start dreaming of it\nAnd take your step that's gonna make a difference\nAnd change your world\n\nYou gotta make believe, make your dreams come true\nIt ain't that hard to do, whoa...\n\nI can't change, I can't change the world alone\nI need you all, everybody, start dreaming of it\nTake your step that's gonna make a difference\nAnd change your world\n\n(I can't change the world alone)\n(I need you all) I need you all, everybody\nTake your step and make a difference\nAnd change the world\n\n(‘Cause I can't change the world alone)\n(I need you all) I need you all, oh everybody\nTake your step that's gonna make a difference\nAnd change your world",https://youtube.com/watch?v=2a1Q_hpGLbs,https://www.youtube.com/watch?v=96be3a5Wl8U,00:00:48
