year,country_id,country,performer,song,place_contest,sf_num,running_final,running_sf,place_final,points_final,place_sf,points_sf,points_tele_final,points_jury_final,points_tele_sf,points_jury_sf,composers,lyricists,lyrics,youtube_url,youtube_url_studio,start
2015,Moldova,Moldova,Eduard Romanyuta,I Want Your Love,28,1.0,,1.0,,,11.0,41.0,,,,,Erik Lewander;Hayley Aitken;Tom Andrews,,"Hey girl\nRemind me why we ain’t together\nWe got that magnetic connection\nMoving so fast, let’s take it slow\nAin’t gonna let you let me go\n\nThe future that you’re painting\nGot me all anticipating\n\nNothing can steal your thunder\nSky high when you pull me under\n‘Cause you got what I want, what I want\nWhat I want, want, want, want\n\nYeah baby, let me show ya\nYou got me drifting over\n‘Cause you got what I want, what I want\nWhat I want, want, want, I want your love\n\nI want your love, I want your love\nI want your love\n\nHey girl\nEven if there’s stormy weather\nYou’ve got my heartbeat beating faster\nAnd I’m not gonna let you down\nNo your feet ain’t gonna touch the ground\n\nThe future that you’re painting\nGot me all anticipating\n\nNothing can steal your thunder\nSky high when you pull me under\n‘Cause you got what I want, what I want\nWhat I want, want, want, want\n\nYeah baby, let me show ya\nYou got me drifting over\n‘Cause you got what I want, what I want\nWhat I want, want, want, I want your love\n\nI want your love, I want your love\nI want your love\n\nOh yeah\nThe picture that you’re painting\nGot me anticipating\n\nNothing can steal your thunder\nSky high when you pull me under\n‘Cause you got what I want, what I want\nWhat I want, want, want, I want your love\n\nYeah baby, let me show ya\nYou got me drifting over\n‘Cause you got what I want, what I want\nWhat I want, want, want, I want your love\n\nNothing can steal your thunder\nSky high when you pull me under\n‘Cause you got what I want, what I want\nWhat I want, want, want, want\n\nYeah baby, let me show ya\nYou got me drifting over\n‘Cause you got what I want, what I want\nWhat I want, want, want, I want your love\n\nI want your love, I want your love\nI want your love",https://youtube.com/watch?v=px1MoZ0k7qY,https://www.youtube.com/watch?v=mVN723iwj8c,00:00:37
2015,Malta,Malta,Amber,Warrior,29,2.0,,5.0,,,11.0,43.0,,,,,Elton Zarb,Matt Mercieca,"We suffer silently,\nalways fighting to break free.\n\nWe were living in a shadow.\nWe were too scared to let go.\nWouldn’t accept defeat.\n\nWhen by losing we were winning.\nWe have to be courageous\nto be able to get through this.\nAnd then it hits.\n\nBreak through the silence\nThe noise is louder than its ever been\nCreate something timeless\nNever look back\nThe past is the past\nI had no choice but to become a\nWarrior\nI had to conquer\nI did not break, I left my faith in hope\n\nWe are not the enemy,\nWe’re just tired of suffering.\n\nWe broke through the shadows\nWe finally let go\nit was not defeat\nit was us truly winning\nWe were courageous\nand we got through this.\nAnd then it hits.\n\nBreak through the silence\nThe noise is louder than its ever been\nCreate something timeless\nNever look back\nThe past is the past\nI had no choice but to become a\nWarrior\nI had to conquer\nI did not break, I left my faith in hope\n\nI’m a warrior, I will conquer\nI’m a warrior, I will conquer\nI’m a warrior!",https://youtube.com/watch?v=SaJxu3vorLc,https://www.youtube.com/watch?v=wevxW3l_tkg,00:00:42
2015,Belarus,Belarus,Uzari & Maimuna,Time,30,1.0,,11.0,,,12.0,39.0,,,,,Yuri Navrotsky,Maimuna;Svetlana Geraskova,"Tell me where I belong\nI’ve been trying for so long\nBreaking out through the night\nMade me see the bright light\nNow I’m willing to fight\nAnd I know that time is on my side\n\nTime is like thunder ah-ah\nHear it like thunder ah-ah\nAll we’ve got are some days\nAnd I try not to waste\n\nTime is like thunder ah-ah\nBeating like thunder in our heads\nTime is like thunder ah-ah\nAh-ah ah-ah\n\nI don’t wanna wait any longer\nI don’t wanna wait any longer\nI don’t wanna wait any longer\nI don’t wanna wait any longer\n\nAt the end of your rope\nKeep on hoping against the hope\nOh-oh\nTime is fading away\nSo don’t you lose a day\nWe can do what we say\n\nTime is like thunder\nNo more!\nTime is like thunder\nI know, you know\nTime is like thunder\nI don’t want to wait!\n\nOoh, like thunder, like thunder\nYou know, I know\nDon’t you lose a day!\n\nTime is like thunder ah-ah\nHear it like thunder ah-ah\nAll we’ve got are some days\nAnd I try not to waste\n\nTime is like thunder ah-ah\nBeating like thunder\nTime is like thunder ah-ah\nAh-ah ah-ah\n\nI don’t wanna wait any longer!",https://youtube.com/watch?v=Cwjm1lRV4N4,https://www.youtube.com/watch?v=M8ZADtaAvDA,00:00:45
2015,Ireland,Ireland,Molly Sterling,Playing With Numbers,31,2.0,,2.0,,,12.0,35.0,,,,,Greg French;Molly Sterling,Greg French,"Do I owe you something?\nI think I do\nThey tied our hands\nBut I cut through\n\nIn the arms of the potion\nThey found our truth\nAnd I made a burrow\nAbandoned you\n\nAnd I made the mess in your vision\nAnd I see a debt to be paid\nTo give a little love was all I wanted\nGive a little love was all my intent\n\nAnd I was playing with numbers\nAnd I didn't know what it meant\n\nPlease don't remind me\nI won't be your news\nFragile misguided minds like mine\nOnly bow to you\n\nOh, while I played with white lies and fiction\nUnbeknownst to you\nI played the victim\nWell that was the last time I pierced you\n\nAnd I made the mess in your vision\nAnd I see a debt to be paid\nTo give a little love was all I wanted\nGive a little love was all my intent\n\nAnd I was playing with numbers\nAnd I didn't know what it meant\n\nI can watch from afar, from my heart to my home\nAll along I was lost, I was worse, this is wrong\nI can't force this, just watch as the surface surrenders it all\n\nI made the mess in your vision\nAnd I see a debt to be paid\nTo give a little love was all I wanted\nGive a little love was all my intent\n\nI was playing with numbers\nAnd I didn't know what it meant",https://youtube.com/watch?v=3B5sdNJF0lk,https://www.youtube.com/watch?v=zBZ7XSYX90E,00:00:38
2015,Denmark,Denmark,Anti Social Media,The Way You Are,32,1.0,,13.0,,,13.0,33.0,,,,,Chief 1;Remee,,"Summer’s here, winter’s gone\nFinally I can see the sun\nEvery time you walk into the room\n\nAnd all my fears disappear\nWhen I’m in your atmosphere\nI don’t know what it is you do\n\nBut you do\n(Yeah, yeah, yeah)\nBut you do\n(Yeah, yeah, yeah)\nAnd I can’t explain why\n\nIt’s the way you are\nIt’s just the way that you are\nThat can make my day\nThe bad times go away\n\nIt’s the way you are\nIt’s just the way that you are\nThat can make my day\nThe bad times go away\n\nLike an old radio\nA song I just can’t let go\nAll I got on my mind is you\nMovie stars and caviar\nCouldn’t get me where you are\nThere’s nothing I could do about it\n\nIt’s the way you are\nIt’s just the way that you are\nThat can make my day\nThe bad times go away\n\nAnd I’ll be right there\nWhen you need someone to guide you\n(Guide you)\nWhatever it takes, girl\nI will be doing it for you\n(For you)\n\n‘Cause I’ve been acting like a fool\nI wanna take my time and spent it all on you\nSo girl just come and sweep my feet off the ground\nLike you do\n\nIt’s the way you are\nIt’s just the way that you are\nThat can make my day\nThe bad times go away\n\nHey, it’s the way you are\nIt’s just the way that you are\nThat can make my day\nThe bad times go away\n\nBecause it’s all about you\nBecause it’s all about you, girl\nAnd I’m hanging on to every single word you say\n\nIt’s the way you are\nIt’s just the way that you are\nThat can make my day\nThe bad times go away\n\nIt's the way you are",https://youtube.com/watch?v=J--Tgi_iZQ8,https://www.youtube.com/watch?v=hASaICVH5Sg,00:00:33
2015,Netherlands,Netherlands,Trijntje Oosterhuis,Walk Along,33,1.0,,4.0,,,14.0,33.0,,,,,Tobias Karlsson,Anouk Teeuwe,"I open up my heart to you\nI cry for your attention\nStill you haven't seen it yet\nYou only see me as a friend\nBut I wish you were waiting\nWith roses at sunset\nWhy? why-y-y, why-y-y-y?\nWon't you walk along, walk along\nBaby\nWhy? why-y-y, why-y-y-y?\nWon't you walk along, walk along\nBaby\n\nGentle smile passing your way\nIt's not that I don't try\nBut you don't even notice me here\nIn another time and place,\nAnother lifetime maybe\nIf only for a little while\nWhy? why-y-y, why-y-y-y?\nWon't you walk along, walk along\nBaby\nWhy? why-y-y, why-y-y-y?\nWon't you walk along, walk along\nBaby\n\nI don't seem to get you\nTo look at me one time\nWon't you walk along, walk along\nBaby, this is not a little crush\nDon't wanna wait in line\nWon't you walk along, walk along\nBaby!\n\nUuh uuh\nUuh uuh\nI love you, I love you baby\nUuh uuh\nUuh uuh\nIf only for a little while\n\nWhy? why-y-y, why-y-y-y?\nWon't you walk along, walk along\nBaby\nWhy? why-y-y, why-y-y-y?\nWon't you walk along, walk along\nBaby\nWhy? Why-y-y, why-y-y-y?\nI love you, I love you baby\nWhy? Why-y-y, why-y-y-y?\nWon't you walk along, walk along baby",https://youtube.com/watch?v=O_fs4SPGyF0,https://www.youtube.com/watch?v=eSZwKW3RqT0,00:00:23
2015,Czech Republic,Czech Republic,Marta Jandová & Václav Noid Bárta,Hope Never Dies,34,2.0,,8.0,,,13.0,33.0,,,,,Václav Noid Bárta,Tereza Šoralová,"Wait for me, don’t cross the sea of pain\nWait for me, I’m lost, I’ve gone astray\nRavens calling my name, their wings so dark\nSoon they’ll take me away, I have their mark\nThey never miss their prey\n\nThere is no light to pray for\nCold and dim are the skies\nWounded, lying, running out of life\nOut of life\n\nIn your eyes I could see\nOur hopes and our future\nNow we must let go\n\nFind me where the night turns into day\nTurns into day, your love as a torch shows us the way\nThe way how to be whole again\n\nThere is no light to pray for\nCold and dim are the skies\nWounded, lying, running out of life\nOut of life\n\nIn your eyes I could see\nOur hopes and our future\nNow we must let go\n\nMust let go\nMust let fade away\nOr we can rise and fight\n\nFor a light to live for\nFire in our hearts\nThrough our pain\nThrough all the, all the lies\n\nWe will walk, walk reborn\nHope never dies\nNever let me go\n\nNever let me go",https://youtube.com/watch?v=SLz6VeSPXjA,https://www.youtube.com/watch?v=P_o44RdxYTY,00:00:37
2015,North Macedonia,North Macedonia,Daniel Kajmakoski,Autumn Leaves,35,1.0,,8.0,,,15.0,28.0,,,,,Joacim Persson,,Met in the dark of night you were my lucky strike crazy kids with out a clue\nHanging from our knees up in the willow trees easy like the month of June\nA fairytale gone right with no ending in sight had me tangled up in blue\nYou said we'd never change but maybe we do\n\nBaby this is all we ever used to know \nBut I can see your colours change to red and gold\n\nEvery moment will hurt\nFrom the last to the ﬁrst\nAnd I'm trying ﬁnd a way to breathe\nClose the book and the chapter forever and after \nI'm falling like the autumn leaves\nMy heart is beating like a million drums\nCuz your the ground under my feet\nI'm trying to hold on but baby I'm falling free\nLike the autumn leaves \n\nBaby this is all we ever used to know \nBut I can see your colours change to red and gold\n\nEvery moment will hurt\nFrom the last to the ﬁrst\nAnd I'm trying ﬁnd a way to breathe \nClose the book and the chapter forever and after \nI'm falling like the autumn leaves \nMy heart is beating like a million drums\nCuz your the ground under my feet \nI'm trying to hold on but baby I'm falling free \nLike the autumn leaves,https://youtube.com/watch?v=TtSum7ouImU,https://www.youtube.com/watch?v=t8QCt6CJCHc,00:01:03
2015,Portugal,Portugal,Leonor Andrade,Há um mar que nos Separa,36,2.0,,7.0,,,14.0,19.0,,,,,Miguel Gameiro,,São três da manha e a chuva cai nas ruas da cidade\nBate uma saudade no meu peito\nVejo se me endireito mas falta-me a vontade\nEu não sou eu se tu não estás\n\nSe é o mar que nos separa\nVou secá-lo de saudade\nE apertar-te contra o peito\nBeijo feito de vontade\n\nAinda tenho as tuas mãos no meu rosto\nE o gosto a mel da tua boca\nLouca foi a noite em que te conheci\nTriste a madrugada em que te perdi\n\nSe é o mar que nos separa\nVou secá-lo de saudade\nE apertar-te contra o peito\nBeijo feito de vontade\n\nSe é o mar que nos separa\nVou secá-lo de saudade\nE apertar-te contra o peito\nBeijo feito de vontade\n\nSe é o mar que nos separa,https://youtube.com/watch?v=vE-LqXkb0ok,https://www.youtube.com/watch?v=dYxcffHv05U,00:00:38
2015,Iceland,Iceland,María Ólafsdóttir,Unbroken,37,2.0,,12.0,,,15.0,14.0,,,,,Ásgeir Orri Ásgeirsson;Pálmi Ragnar Ásgeirsson;Sæþór Kristjánsson,Ásgeir Orri Ásgeirsson;María Ólafsdóttir;Pálmi Ragnar Ásgeirsson;Sæþór Kristjánsson,One step at a time\nout of the darkness\none foot in front of the other.\n\nOne step at a time\ninto the distance\na new path I need to uncover.\n\nI'm letting go.\nGo.\n\nOne step at a time\nget out of the darkness\nand into the light forever.\nOne step at a time\nI pick up the pieces\ntry putting them back together\ntill I'm unbroken.\nUnbroken.\nOne step at a time\nget out of the darkness\nand into the light forever.\n\nOne step at a time\nand I got a feeling\nit's either now or never.\n\nI'm letting go.\nGo.\n\nOne step at a time\nget out of the darkness\nand into the light forever.\nOne step at a time\nI pick up the pieces\ntry putting them back together\ntill I'm unbroken.\nUnbroken\n\nOne step at a time\nget out of the darkness\nand into the light forever.\n\nI'm letting gon.\nGo. \n\nOne step at a time\nget out of the darkness\nand into the light forever.\nOne step at a time\nI pick up the pieces\ntry putting them back together\ntill I'm unbroken.\nUnbroken. \n\nOne step at a time\nget out of the darkness\nand into the light forever.\n\nI'm letting go.\nGo.\n\nOne step at a time\nget out of the darkness\nand into the light forever.\nOne step at a time\nI pick up the pieces\ntry putting them back together\n'til I'm unbroken.\nUnbroken. \n\nOne step at a time\nget out of the darkness\nand into the light forever.,https://youtube.com/watch?v=0Jl-Hr137uM,https://www.youtube.com/watch?v=sov_pE1cdFY,00:00:38
2015,Finland,Finland,Pertti Kurikan Nimipäivät,Aina Mun Pitää,38,1.0,,5.0,,,16.0,13.0,,,,,Kari Aalto;Pertti Kurikka;Sami Helle;Toni Välitalo,,"aina mun pitää siivota\naina mun pitää tiskata\naina mun pitää käydä töissä\naina mun pitää käydä lääkärissä\nei saa mennä koneelle\nen katsoa telkkarii\nen saa edes nähdä mun kavereita\naina mun pitää olla kotona\naina mun pitää hoitaa tehtäviä\naina mun pitää syödä kunnolla\naina mun pitää juoda kunnolla\nen saa syödä karkkia, juoda limua\nen saa edes juoda alkoholia\naina mun pitää levätä\naina mun pitää nukkua\naina mun pitää herätä\naina mun pitää käydä suihkussa",https://youtube.com/watch?v=v4Y0HOPL5GU,https://www.youtube.com/watch?v=zEiM6l5meQI,00:00:11
2015,San Marino,San Marino,Michele Perniola & Anita Simoncini,Chain Of Lights,39,2.0,,3.0,,,16.0,11.0,,,,,Ralph Siegel,John O'Flynn,"No\n\nI don't wanna dream forever\nOf a time when peace was more than just a simple word\nI wanna find a better way of living\nAnd connect my tears and fears with friends \nUnderstanding and forgiving\nMust give this world a final chance\n\nI can feel life is changin'\nTimes are rearrangin'\nIn so many many ways\nLet us try to make the world\nA better place\n\nSo light up the candles\nLet's illuminate the night\nJust light up the candles\nLet Them shine on deep inside\nBuild a chain of light for you \nAnd a chain of light for me\nAnd believe that we can change reality\n\nWe've only got one life\nSo let's try to make our dreams survive\nMaybe we'll find out that many people feel the same – oh yeah\nOne's a lonely number – but together\nWe can make a million candles \nShine forever\nLet us build a chain of hearts\nIn a world that‘s blue and dark\n\nSo light up the candles\nLet's illuminate the night\nAn' together hand in hand\nWe will feel the love inside\nBuild a chain of love for you\n(chain of love for you)\nAnd a chain of love for me\n(chain of love for me)\nWe will let our vision change reality\n\nIf we all light a candle\nWe could build a chain of light\nIf we all walk together\nWe will feel the love inside\nIt's a chain of hearts for you\nChain of hearts for you\nAnd a chain of hearts for me\nChain of hearts for me\nLet's create a world that's human, fair and bright\n\nIf we all light a candle\n(If we all light a candle)\nWe‘d illuminate the night\n(We'd illuminate the night)\nIf we all walk together\n(Yes we should)\nWe will feel the love inside\nIt's a chain of light for you \nChain of light for you\nAnd a chain of light for me\nChain of light for me\nWe can build a peaceful world – \nLet's do it right\nStanding side by side\nIt's a chain of love for you\nChain of love for you\nAnd a chain of love for me\nChain of love for me\nLet's create a world that's human, fair and bright",https://youtube.com/watch?v=FE1KJYNvVAE,https://www.youtube.com/watch?v=l5of_gx0kjA,00:00:40
2015,Switzerland,Switzerland,Mélanie René,Time To Shine,40,2.0,,14.0,,,17.0,4.0,,,,,Mélanie René,,"I've been walking, in the darkness\nAlways hiding from my true self\nAfraid of letting go, of deception in their eyes\nA wounded ego, unafraid to start a fight\n\nI've been walking, on a lonely road\nFor many stories, I have once been told\nNo matter what they say\nI will follow my heart\nI think it's time for me to stand up\nAnd hold my ground\n\n'Cause I'm living my dreams\nNever been so alive\nThe sky's the limit\nnow that I know I can fly\nNo more pulling me down, no more mucking around\nI'm growing up, I'm growing up\nAnd it's my time to shine\nYeah, it's my time to shine\n\nIt don't matter if I'm wrong or right\nI'm getting stronger every time\nI try not to let it go\nTake it one step at a time\nI've made my ego, now it's time for me to let it shine\n\n'Cause I'm living my dreams\nThe sky's the limit\nnow that I know I can fly\nNo more pulling me down, no more mucking around\nI'm growing up, I'm growing up\nAnd it's my time to shine\nYeah, it's my time to shine\n\nI've been walking, in the darkness\nAlways hiding from my true self\nI've learned to let it go\nI've learned to let it go\nI've learned to let it go\nNow it's my time to shine\n\n'Cause I'm living my dreams\nNever been so alive\nThe sky's the limit\nnow that I know I can fly\nNo more pulling me down, no more mucking around\nI'm growing up, I'm growing up\nAnd it's my time to shine\nYeah, it's my time to shine",https://youtube.com/watch?v=ya1r_nFHiCQ,https://www.youtube.com/watch?v=_n_pXW3p74Q,00:00:50

2016,ua,Ukraine,Jamala,1944,1,2.0,21.0,14.0,1.0,534.0,2.0,287.0,323.0,211.0,152.0,135.0,Jamala,,"When strangers are coming\nThey come to your house\nThey kill you all and say\nWe're not guilty, not guilty\n\nWhere is your mind? Humanity cries\nYou think you are gods but everyone dies\nDon't swallow my soul\nOur souls\n\nYaşlığıma toyalmadım\nMen bu yerde yaşalmadım\nYaşlığıma toyalmadım\nMen bu yerde yaşalmadım\n\nWe could build a future\nWhere people are free\nTo live and love\nThe happiest time, our time\n\nWhere is your heart? Humanity rise\nYou think you are gods but everyone dies\nDon't swallow my soul\nOur souls\n\nYaşlığıma toyalmadım, ooh\nMen bu yerde yaşalmadım\nYaşlığıma toyalmadım\nMen bu yerde yaşalmadım\n\nYaşlığıma toyalmadım, oh, oh\nMen bu yerde yaşalmadım\nYaşlığıma toyalmadım\nVatanıma toyalmadım",https://youtube.com/watch?v=B-rnM-MwRHY,https://www.youtube.com/watch?v=ydKDwFPlXTw,00:00:59
2016,au,Australia,Dami Im,Sound of Silence,2,2.0,13.0,10.0,2.0,511.0,1.0,330.0,191.0,320.0,142.0,188.0,Anthony Egizii;David Musumeci,,Growing tired and weary brown eyes\nTrying to feel your love through face time \nSymphonies of dreams and highlights \nCaught up in this crazy fast life\nBut baby you're not here with me \nAnd I keep calling calling \nKeep calling cause\n\nNow my heart awakes to the sound of silence \nAnd it beats to the sound of silence \nAnd it beats to the sound of silence \nNow my heart awakes to the sound of silence \nAnd it beats to the sound of silence \nAnd it beats to the sound of silence\n\nGetting hard to break through the madness \nYou're not here it never makes sense \nTidal waves of tears are crashing \nNo one here to save me drowning \nCause baby you're not here with me \nAnd I keep calling calling \nKeep calling cause\n\nNow my heart awakes to the sound of silence \nAnd it beats to the sound of silence \nAnd it beats to the sound of silence \nNow my heart awakes to the sound of silence \nAnd it beats to the sound of silence \nAnd it beats to the sound of silence\n\nI know I'm stronger and I'm capable\nI know it's all in my head\nBut I keep calling calling\nCalling calling\n\nNow my heart awakes to the sound of silence \nAnd it beats to the sound of silence \nAnd it beats to the sound of silence \nNow my heart awakes to the sound of silence \nAnd it beats to the sound of silence \nAnd it beats to the sound of silence,https://youtube.com/watch?v=5ymFX91HwM0,https://www.youtube.com/watch?v=2EG_Jtw4OyU,00:00:39
2016,ru,Russia,Sergey Lazarev,You Are the Only One,3,1.0,18.0,9.0,3.0,491.0,1.0,342.0,361.0,130.0,194.0,148.0,Dimitris Kontopoulos;Philipp Kirkorov,John Ballard;Ralph Charlie,"We can never let the word be unspoken\nWe will never let our loving go, come undone\nEverything we had is staying unbroken, oh\nYou will always be the only one\n\n​You're the only one\n​\n​Won't ever give up 'cause you're ​still somewhere out there\nNothing or no one's gonna keep us apart\n​Breaking it down but I'm still getting nowhere\n​Won't stop, hold on\n\n​Thunder and lightning, it's getting exciting\n​Lights up the skyline to show where you are\n​My love is rising, the story's unwinding\n​Together we'll make it and reach for the stars\n\n​You're the only one, you're my only one\n​You're my life, every breath that I take\n​Unforgettable, so unbelievable\n​You're the only one, my only one\n\n​I could have told you to slow down and stay down\n​I could have told you a secret, won't you keep it now?\n​Thinking of making a showdown when love is found\n​Thinking of waiting till you're around\n​\n​​Won't ever give up 'cause you're ​still somewhere out there\nNothing or no one's gonna keep us apart\n​Breaking it down but I'm still getting nowhere\n​Won't stop, hold on\n\n​Thunder and lightning, it's getting exciting\n​Lights up the skyline to show where you are\n​My love is rising, the story's unwinding\n​Together we'll make it and reach for the stars\n\n​You're the only one, you're my only one\n​You're my life, every breath that I take\n​Unforgettable, so unbelievable\n​You're the only one, my only one\n\nYou're my only one\n\n​Thunder… (and lightning)\n(It's getting exciting) It's getting exciting…\n(​Lights up the skyline to show where you are)\nTo show where you are…\n\n(​You're the only one) You're my only one\n​You're my life, every breath that I take\n​Unforgettable, so unbelievable\n​You're the only one, my only one",https://youtube.com/watch?v=e94dst20C9Y,https://www.youtube.com/watch?v=gHgxi57Um0w,00:00:56
2016,bg,Bulgaria,Poli Genova,If Love Was a Crime,4,2.0,8.0,12.0,4.0,307.0,5.0,220.0,180.0,127.0,122.0,98.0,Borislav Milanov;Joacim Persson;Sebastian Arman,Borislav Milanov;Joacim Persson;Poli Genova;Sebastian Arman,"You and I we collide\nLike the stars on the summer night\nWe can shine for ever\n\nAnd you and I we're alive\nWhat we feel is what is right\nWe can run like never\n\nIf love was a crime then we would be criminals\nLocked up for life but I'll do the time\nIf love was a crime then we would work miracles\nHigh above the ground\n\nThey will never break us down\n\nО, Day mi lyubovta\nDay mi lyubovta\nО, Day mi lyubovta\nThey will never break us down\nО, Day mi lyubovta\nDay mi lyubovta\nО, Day mi lyubovta\nThey will never break us down\n\nNever mind \nWrong or right\nOur love ain't got no pride\nSo we change for better\n\nUnafraid\nNever fade\nWhen it's dark we illuminate\nCan we rise together\n\nIf love was a crime then we would be criminals\nLocked up for life but I'll do the time\nIf love was a crime then we would work miracles\nHigh above the ground\n\nThey will never break us down\n\nО, Day mi lyubovta\nDay mi lyubovta\nО, Day mi lyubovta\nThey will never break us down\nО, Day mi lyubovta\nDay mi lyubovta\nО, Day mi lyubovta\nThey will never break us down\n\nTogether we're untouchable\nYou and me against the world\nTogether we're invincible\nTogether we're untouchable\nYou and me against the world\nTogether we're invincible\nThey will never break us down",https://youtube.com/watch?v=PQqUTigWKHY,https://www.youtube.com/watch?v=yKsNfccUTuk,00:00:44
