year,country_id,country,performer,song,place_contest,sf_num,running_final,running_sf,place_final,points_final,place_sf,points_sf,points_tele_final,points_jury_final,points_tele_sf,points_jury_sf,composers,lyricists,lyrics,youtube_url,youtube_url_studio,start
2017,Georgia,Georgia,Tamara Gachechiladze,Keep The Faith,27,1.0,,2.0,,,11.0,99.0,,,37.0,62.0,Anri Jokhadze,Tamara Gachechiladze,"Who told you to hide behind the veil?\nWho told you to get out of the way?\nDon't you let them steal your dreams\nFeel the courage, spread your wings and breathe\n\nKeep the faith, keep the faith\nRemember you are not alone\nHold my hand and come along\nYou, keep the faith, keep the faith\nDon't let nobody turn you down\nEven if the world is rough\n\nWho told you that i reached the point with no regrets?\nWho told you that my life is a book of fairytales?\nI have lost many times,\nBut I've never lost my hope\n\nKeep the faith, keep the faith\nRemember you are not alone\nHold my hand and come along\nYou, keep the faith, keep the faith\nDon't let nobody turn you down\nEven if the world is rough\n\nOhh, ohh, ohh\nYou got to stand on your own\nCrowd hear me out\nThe world needs more love\n\n(Keep the faith, keep the faith)\nRemember you are not alone\nHold my hand and come along\nYou, keep the faith, keep the faith\nDon't let nobody turn you down\nEven if the world is rough\n\nOhh, ohh, ohh\nKeep the faith!",https://youtube.com/watch?v=agSS_a3ccgA,https://www.youtube.com/watch?v=fMjoNAZ1DpU,00:00:42
2017,Serbia,Serbia,Tijana Bogićević,In Too Deep,28,2.0,,1.0,,,11.0,98.0,,,45.0,53.0,Borislav Milanov;Joacim Persson;Johan Alkenäs;Lisa Desmond,,Wish that I knew where I lost\nRight where there was no going back\nThe line was crossed\n\nBut I love what you're doing to me\nHow you spin me around\nHigh off the ground\nI'm not coming down\n\nWon't somebody save me tonight?\nFeels like I've been sentenced to life\nI'm falling so deep\nI'm in too deep\nI'm falling so deep\n\nNo escaping over my head\nStruck by every word that you've said\nI'm falling so deep\nI'm in too deep\nI'm falling so deep\n\nLove doesn't seem to make sense\nYou just broke into my heart\nGot no defence\nHow you spin me around\nHigh off the ground\nI'm not coming down\n\nWon't somebody save me tonight?\nFeels like I've been sentenced to life\nI'm falling so deep\nI'm in too deep\nI'm falling so deep\n\nNo escaping over my head\nStruck by every word that you said\nI'm falling so deep\nI'm in too deep\nI'm falling so deep\n\nFalling so deep\n\nI'm in lightning speed\nAnd I can't slow down\nMy heart is racing\nWhen you're around\n\nWon't somebody save me tonight?\nFeels like I've been sentenced to life\nI'm falling so deep\nI'm in too deep\nI'm falling so deep\n\nNo escaping over my head\nStruck by every word that you said\nI'm falling so deep\nI'm in too deep\nI'm falling so deep\n\nI'm in too deep\nI'm falling so deep,https://youtube.com/watch?v=A0wAd-a0hXA,https://www.youtube.com/watch?v=,00:00:50
2017,Switzerland,Switzerland,Timebelle,Apollo,29,2.0,,13.0,,,12.0,97.0,,,49.0,48.0,Alessandra Günthardt;Elias Näslin;Nicolas Günthardt,,"Like a bullet in my chest,\nYou're written, bound and etched\nForever in my mind\n\nWe are fading in our hands\nLost somewhere in a wasteland\nNot knowing up from down\n\nBut when the walls are caving\nAnd the world keeps turning\nWe got the love, we got to love\n\nNow I will never let you go\nAll the words won't make me fold\nIt is never easy\nI'll follow you, Apollo\n\nNow I will never let you go\nGive it time and we will grow\nAin't no fun in easy\nI'll follow you, Apollo\nI'll follow you, Apollo\n\nI wear my heart on my sleeve\nYou do the same for me\nWhen autumn comes around\n\nBut when the walls are caving\nAnd the world keeps turning\nWe got the love, we got to love\n\nNow I will never let you go\nAll the words won't make me fold\nIt is never easy\nI'll follow you, Apollo\n\nNow I will never let you go\nGive it time and we will grow\nAin't no fun in easy\nI'll follow you, Apollo\nI'll follow you-u\n\nSo don't pull the rug from underneath us\nWe're in trouble babe, but we got the love\nDon't pull the rug from underneath us\nCrashing down fast, as fragile as glass\n\nBut what are we now if we never tried?\nWhat are we now?\n\nI will never let you go\nGive it time and we will grow\nIt is not supposed to be easy\n\nNow I will never let you go\nGive it time and we will grow\nAin't no fun in easy\nI'll follow you, Apollo\nI'll follow you, Apollo\n\nYou, Apollo\nIt is never easy\nI'll follow you, Apollo\nI'll follow you, Apollo\n\nYou, Apollo\nIt is never easy\nI'll follow you, Apollo\nI'll follow you, Apollo",https://youtube.com/watch?v=OrNPRfS9Sbg,https://www.youtube.com/watch?v=rTENOP3tbjU,00:00:45
2017,Finland,Finland,Norma John,Blackbird,30,1.0,,7.0,,,12.0,92.0,,,51.0,41.0,Lasse Piirainen;Leena Tirronen,,"Blackbird, blackbird, don't sing to me\nDon't sing below my window\nFly somewhere else, don't bother me\nDon't sing below my window\n\nYou sang when he was in my bed\nYou sang when my heart sang\nNow, now you remind me\nof something I'll never have\nSo, blackbird, don't sing\nBlackbird, don't sing\n\nBlackbird, blackbird I am now alone\nSomewhere else go make your home\nDon't nestle here, go find lovers of your own\nI am now alone\n\nYou sang when he was in my bed\nYou sang when my heart sang\nNow, now you remind me\nof something I'll never have\nSo, blackbird, don't sing\nBlackbird, don't sing\nBlackbird, don't sing\n\nYou sang when he was in my bed\nYou sang when my heart sang\nNow you remind me\nof something I'll never have\nSo, blackbird, don't sing\nBlackbird, don't sing\nBlackbird, don't sing",https://youtube.com/watch?v=Ufba0nOz0fQ,https://www.youtube.com/watch?v=qTLczT5h9Lo,00:00:31
2017,Ireland,Ireland,Brendan Murray,Dying To Try,31,2.0,,9.0,,,13.0,86.0,,,41.0,45.0,James Newman;Jörgen Elofsson,,"Take a leap of faith with me\nIf you believe honestly\nThat I am yours and you are mine\nI know you're scared, and so am I\n\n'Cause I know that love can be so strong\nAnd yet so frail\nAnd there ain't no guarantee\nThat you and me won't fail\n\nBut I'm dying to try\nI'm dying to try\nI'll keep you safe in my arms\nBuild a bridge to your heart every day\n\nI'll give you it all\nBut I'm not gonna lie\n'Cause no one can promise\nThat love will ever learn how to fly\nWill ever learn how to fly, oh…\n\nBut I'm dying to try, but I'm dying to try\n('Cause no one can promise)\n(That love will ever learn how to fly) Yeah…\n\nI'm dying to try, I'm dying to try\nI'll keep you safe in my arms\nBuild a bridge to your heart every day\n\nI'll give you it all\nBut I'm not gonna lie\nOh, 'cause no one can promise\nThat love will ever learn how to fly\n\nOh, 'cause no one can promise\nThat love will ever learn how to fly\nBut I'm dying to try\nTake a leap if you believe",https://youtube.com/watch?v=EOpZikqrfOA,https://www.youtube.com/watch?v=Dp3apBsLjvk,00:00:55
2017,Estonia,Estonia,Koit Toome & Laura,Verona,32,2.0,,17.0,,,14.0,85.0,,,69.0,16.0,Sven Lõhmus,,Sleeping all alone\nYou wake up with a bottle in your hands\nNo sound of serenade\nCause we both know we lost our game\n\nI was always high on loving you\nBefore the romance turned to drama\nLike Romeo and Juliet once before\nWe are lost in Verona\n\nLearning through the scars\nWill make you stronger time is the proof\nI´m not a loner kind\nI know I just can't get over you\n\nI was always trying to tell the truth\nBefore the romance turned to drama\nI hoped the best in me was always you\nBefore we lost our Verona\n\nWe are lost\nLost in the crowd of the street\nWe are lost\nLike two sailing boats in the sea\nWe are lost\nCause sometimes we building and burning down love\nWe have lost our Verona\n\nWe lost and we found our Verona\nWe are lost in Verona\n\nReckless type of love\nReckless type of love\nWe never said: I´m sorry\nWe never said: enough\nThis western type of woman\nWestern type of man\nDisappeared in Verona\n\nWe lost and we found our Verona\nWe are lost in Verona\n\nWe are lost\nLost in the crowd of the street\nWe are lost\nLike two sailing boats in the sea\nWe are lost\nCause sometimes we building and burning down love\nWe have lost our Verona\n\nWe lost and we found our Verona\nWe are lost in Verona,https://youtube.com/watch?v=NxqPpzWYN1c,https://www.youtube.com/watch?v=4vq3GFVeVE8,00:01:30
2017,Czech Republic,Czech Republic,Martina Bárta,My Turn,33,1.0,,14.0,,,13.0,83.0,,,2.0,81.0,Greig Watts;Kyler Niko;Paul Drew;Pete Barringer,,"From the very, very first time I saw you\nYou were my home, you were my home, you were my home\n\nNow that you are falling, let me be your calling\nBe your one prayer, keep away the bad things\nIn this moment let me give to you what you've given to me\nThat's the least I can do\n\nBaby, it's you every time I close my eyes\nIt's always been you\nAnd heaven knows that I'll be waiting always by your side\nBaby, it's you every time that I was down\nYou were there to fix me up, you were there to pick me up\nNow it's my turn\n\nFrom the billion hearts to choose between\nWell I was your choice, I was your choice\nSo let me be your salvation and joy\n\nNow that you are falling, let me be your calling\nBe your one prayer, keep away the bad things\nIn this moment let me give to you what you've given to me\nThat's the least I can do\n\nBaby, it's you every time I close my eyes\nIt's always been you\nAnd heaven knows that I'll be waiting always by your side\nBaby, it's you every time that I was down\nYou were there to fix me up, you were there to pick me up\nNow it's my turn\n\nYou know that I love it when you call just to say hello, oh oh\nWill you let me hear it once more?\n\nBaby, it's you every time I close my eyes\nIt's always been you\nAnd heaven knows that I'll be waiting always by your side, oh yeah\nBaby, it's you, uh uh (Every time that I was done)\nYou were there to fix me up, you were there to pick me up\nNow it's my turn\nI know",https://youtube.com/watch?v=-KT8_ZOHAXE,https://www.youtube.com/watch?v=BoLWemuLP_g,00:00:39
2017,Albania,Albania,Lindita,World,34,1.0,,4.0,,,14.0,76.0,,,38.0,38.0,Klodian Qafoku,Big Basta;Lindita Halimi,"We're so alike, yet different\nAt a loss for words, stuttering\nIt don't make sense, what's happening\nI just don't understand\n\nWhat's this fight all for?\nWhat's the cost of life in this world?\nAlmost impossible\nIs to let the love unite us all\n\nDoes anybody care, I'm weak and I'm afraid\nWondering if I will make it through this day\nFor the life of me I refuse to be anything but free\nBut I'm tired of all the battling, oh…\n\nWhat's this fight all for?\nWhat's the cost of life in this world?\nAll I ever really want\nIs to let the love unite us all\n\nLet the love unite us all\nLet the love unite us all\n\nWhat's this fight all for?\nWhat's the cost of life in this world?\nAll I ever really want\nIs to let the love unite us all\n\nWhat's this fight all for?\nWhat's the cost of life in this world?\nAll I ever really want\nIs to let the love unite us all",https://youtube.com/watch?v=NyKOBMAXFFA,https://www.youtube.com/watch?v=cP0aQAdYNjY,00:00:40
2017,North Macedonia,North Macedonia,Jana Burčeska,Dance Alone,35,2.0,,3.0,,,15.0,69.0,,,40.0,29.0,Alex Omar;Borislav Milanov;Florence A.;Joacim Persson,,"Take down my hair, wash off my make-up\nIt's gonna be a one-man show\nI gotta feel good in saturation\nAnd I'm the only one who knows\n\nI will dance alone wherever I am\nThe rhythm follows\nI will dance alone, I'm lost in the sound\nHolding on to my world\n\nI let the pavement be my catwalk\nI'll bring the fire and feel the heat\nAnd all I need to keep on moving\nIs the sound of my heartbeat\n\nI will dance alone wherever I am\nThe rhythm follows\nI will dance alone, I'm lost in the sound\nHolding on to my world\n\nI'll let it go\nI, I, I'll let it go wild\nI'll let it go\nI, I, I'll let it go\n\nI will dance alone wherever I am\nThe rhythm follows\n\nTake me to places that I've never been\nShow me the faces that I've never seen\n\nI will dance alone wherever I am\nThe rhythm follows\nI will dance alone, I'm lost in the sound\nHolding on to my world (I will dance alone)\n\nI'll let it go\nI, I, I'll let it go wild\nI'll let it go\nI, I, I'll let it go wild\n\nI'll let it go\nI, I, I'll let it go wild\nI'll let it go\nI, I, I'll let it go wild\n\nI'll be dancing on my own\nWishing you could hold me close",https://youtube.com/watch?v=XvIbLOOWfYI,https://www.youtube.com/watch?v=Ddo8n_8pKrQ,00:00:47
2017,Iceland,Iceland,Svala,Paper,36,1.0,,13.0,,,15.0,60.0,,,31.0,29.0,Einar Egilsson;Lester Mendez;Lily Elise;Svala Björgvinsdóttir,Lily Elise;Svala Björgvinsdóttir,"Youʼre under the water,\ntrying to pull me under.\nI reach for you.\nI reach for you.\n\nYou can throw it all at me\nI wonʼt give you up.\nI can handle all your pain\ntake it as it comes.\nI love you right\nbut you make me feel like.\n\nPaper\nyou cut right through\nIʼm stuck like glue to you.\nPaper\nyour darkness pulls\nI loose control again.\n\nDrawing every bit of my truth\ncolor me in with your blue.\nPaper\nyou cut right through\na thousand words for you.\n\nI know I wasnʼt a part of you plan\nI know you think that youʼre being a man\ntell me to leave you alone\ntell me I would be so better off\nbut you donʼt understand.\nI canʼt leave you\nbaby\nI canʼt leave you\n\nBut you make me feel like\n\nPaper\nyou cut right through\nIʼm stuck like glue to you.\nPaper\nyour darkness pulls\nI loose control again.\nDrawing every bit of my truth\ncolor me in with your blue.\nPaper\nyou cut right through\na thousand words for you.\n\n- -\n\nPaper\nyou cut right through\nIʼm stuck like glue to you.\nPaper\nyour darkness pulls\nI loose control again.\n\nDrawing every bit of my trutt\ncolor me in with your blue.\nPaper\nyou cut right through\na thousand words for you.",https://youtube.com/watch?v=UPlm18-AlGg,https://www.youtube.com/watch?v=sFyl7h4_H1k,00:00:48
2017,Montenegro,Montenegro,Slavko Kalezić,Space,37,1.0,,6.0,,,16.0,56.0,,,39.0,17.0,Momčilo Zeković Zeko,Adis Eminić;Iva Boršić;Momčilo Zeković Zeko,"Linen is covered with feathers\nWet dreams, wild nightmares, I surrender\nCome in to me from within\nWe can be as one in the sin\n\nThe spaceship is ready to blow\nDrunk in love I'm gonna explode\nBe my Bonnie, we'll mix and match with Clyde\nLet's explore this galaxy of stars\nLet's explore this galaxy of stars\n\nI have my suit on, no need to worry\nGive me your body, let's write a story\nOur body language\nRocket to the stars\n\nI have my suit on, no need to worry\nGive me your body, let's write a story\nOur body language\nRocket to the stars\n\nShow me your super powers,\nI'm Venus and Mars of the hour\nI'll protect you if you come my way\nLet's soar through the Milky Way\n\nI have my suit on, no need to worry\nGive me your body, let's write a story\nOur body language\nRocket to the stars\n\nI have my suit on, no need to worry\nGive me your body, let's write a story\nOur body language\nRocket to the stars\n\nI have my suit on, no need to worry\nGive me your body, let's write a story\nOur body language\n\nWe're taking off\nWe're taking off\nWe're taking off\n\nIn space we can be as one",https://youtube.com/watch?v=rQ1BXJpfa4I,https://www.youtube.com/watch?v=TWtqWD3TlaA,00:00:49
2017,Malta,Malta,Claudia Faniello,Breathlessly,38,2.0,,4.0,,,16.0,55.0,,,0.0,55.0,Philip Vella;Sean Vella,Gerard James Borg,"I walk the street\nLeaving footprints in your heart\nMy feet are worn\nBut they can handle the cold\n\nI know the game\nI'll take the blame\nI wave my white flag unashamed\n\nSo, here I am\nRight at your door\nCatching my breath before the storm\n\nBreathlessly\nI'll be watching you breathlessly\nKnowing there's a vacancy\nWithin your heart\n\nBreathlessly\nI'll be holding you endlessly\nKnowing that the storm\nIs just about to die\n\nClimbing over walls\nThat always felt too high\nBreathlessly\n\nI'm stepping out\nYet I feel I'm locked inside\nI got the will\nI learned the skill\nOf a true acrobat for love\n\nBreathlessly\nI'll be watching you breathlessly\nKnowing there's a vacancy\nWithin your heart\n\nBreathlessly\nI'll be holding you endlessly\nKnowing that the storm\nIs just about to die\n\nClimbing over walls\nThat always felt too high\nBreathlessly",https://youtube.com/watch?v=OXn-Ettr7yk,https://www.youtube.com/watch?v=Bfoq7udRPwk,00:01:12
2017,Lithuania,Lithuania,Fusedmarc,Rain Of Revolution,39,2.0,,16.0,,,17.0,42.0,,,25.0,17.0,CIILIIA;Denis Zujev;Michail Levin,Denis Zujev;Michail Levin,"Life like roller coaster spinning me around\nRhythm getting faster when I'm upside down\nChanges running through me with the speed of sound\nThere's no wait in dream life, nothing stops me now\n\nMaking a start, making a start\nMaking a start and let the light shine through me\nThinking it out, making a vow\nBreaking irrational fears that are with me\n\nNow I'm getting closer to you\nFeel the rain of revolution\nNow I'm getting closer to you\nThere's no time for your illusion now\n\nYeah yeah…\nYeah yeah… yeah yeah… yeah yeah…\nYeah yeah… yeah yeah… yeah yeah…\nYeah yeah… yeah yeah… yeah yeah…\n\nLooking for the reason I'm still on the road\nIf I'm gonna stop and choose, yeah yeah…\nI feel I'm gonna travel again\n\nMaking a start, making a start\nMaking a start and let the light shine through me\n\nDance to the rhythm of the soul\nDance to the rhythm of the soul\nDance to the rhythm of the soul\nDance to the rhythm of the soul\n\nNow I'm getting closer to you\nFeel the rain of revolution\nNow I'm getting closer to you\nThere's no time for your illusion now\n\nYeah yeah…\nYeah yeah… yeah yeah… yeah yeah…\nYeah yeah… yeah yeah… yeah yeah…\nYeah yeah… yeah yeah… yeah yeah…",https://youtube.com/watch?v=-7WpnSMEPjc,https://www.youtube.com/watch?v=pWihZv7iP8Y,00:00:59
2017,Slovenia,Slovenia,Omar Naber,On My Way,40,1.0,,17.0,,,17.0,36.0,,,20.0,16.0,Omar Naber,,You've all been very kind\nBut I made up my mind\nNow I'm about to leave you all behind\nI'm feeling so alone\nI'm turning down my town\nBefore the rise of sun I will be gone\n\nOn my way\nI'm never coming back\nAnd I pray\nI never gonna cry\nWorld is calling now tonight\nTelling me I'll be alright\nLights will guide you through the night\n\nStill hiding in my shell\nAnd keeping to myself\nI cannot count on anybody else\nI'm burning deep inside\nI'm giving up the fight\nBefore the break of dawn\nI will be gone\n\nOn my way\nI'm never coming back\nAnd I pray\nYou'll never gonna cry\nWorld is calling now tonight\nTelling me I'll be alright\nLights will guide you through the night\n\nOn my way\nI'm never coming back\nAnd I pray\nYou'll never gonna cry\nWorld is calling now tonight\nTelling me I'll be alright\nWorld is calling now tonight\nTelling me I'll be alright\nLights will guide you through the night\n\nOn my way,https://youtube.com/watch?v=vbGub2klcV4,https://www.youtube.com/watch?v=mJxKY8ruRSM,00:00:35
2017,Latvia,Latvia,Triana Park,Line,41,1.0,,18.0,,,18.0,21.0,,,20.0,1.0,Agnese Rakovska;Kristaps Ērglis;Kristians Rakovskis,Agnese Rakovska,"I'm going round in circles\nAnd the door's wide open\nBoy, I still wanna see you\nDays go by, I'm still hoping, hoping\n\nWhere we draw the line?\nTell me, baby, where we draw the line?\nTell me, baby, where we draw the line?\nTell me, baby, where we draw the line?\n\nYou told me to move on\nSearch for loving somebody else\nBut baby, tell me, how will I find it?\nIf all I see is you? All I see is you?\n\n(All I see is you, all I see)\n(All I see is you, all I see)\n\nWhere we draw the line?\nTell me, baby, where we draw the line?\nTell me, baby, where we draw the line?\nTell me, baby, where we draw the line?\n\nWhere we draw the line?\nTell me, baby, where we draw the line?\nTell me, baby, where we draw the line?\nTell me, baby, where we draw the line?\n\nMy heart breaks to see you\nDays go by, I'm still hoping\n\n(All I see is you, all I see)\n(All I see is you)\n\nWhere we draw the line?\nTell me, baby, where we draw the line?\nTell me, baby, where we draw the line?\nTell me, baby, where we draw the line?\n\nWhere we draw the line?\nTell me, baby, where we draw the line?\nTell me, baby, where we draw the line?\nTell me, baby, where we draw the line?",https://youtube.com/watch?v=Vxos6ceOrRA,https://www.youtube.com/watch?v=PFdSKiWyF_k,00:01:06
2017,San Marino,San Marino,Valentina Monetta & Jimmie Wilson,Spirit Of The Night,42,2.0,,10.0,,,18.0,1.0,,,1.0,0.0,Ralph Siegel,Jutta Staudenmayer;Steven Barnacle,"♂ Hey, are you the one I dream about?\n♀ Baby I am\n♂ I really feel the night can take away my doubt\n♀ I'll try and do what I can \n♂ Every time I see you smile there is sadness in your eyes\n♀ Well I've been hurt before \n♂ I know it's nothing new, and time will make you realize\n♀ We always wish for more\n\nWe find we're searching high and low and always looking for the right time\nTogether we – can – make it through the night	\n\nIt's the spirit of the night	\nSpirit of the night\nBurning like St. Elmo's fire	\nSpirit of the night\nTakes our feelings so much higher\n♀ It's the spirit of the night	\n♂ We can live our fantasy \nSpirit of the night\nBurning in our ecstasy\n\n♂ Hey, are you the one to take my pain\n♀ Just take my hand\n♂ I've been so hurt before, it's hard to trust again\n♀ You know I understand\n♂ You've got me feeling right, and I can see the future is bright\n♀ I'll take your blues away\nSo no more searching high and low and always looking for the right time\n\nTogether we (we) – can (can) – make it trough the night\n\nIt's the spirit of the night	\nSpirit of the night\nBurning like St. Elmo's fire	\nSpirit of the night\nTakes our feelings so much higher\n♂ Feed our deep desire\n\n♀ It's the spirit of the night	\n♂ It's a feeling – got me reeling	\n♂ We can live our fantasy \n♀ It's the spirit of the night	\n♂ It's a feeling, just a feeling\n♂ Burning in our ecstasy\n\n♀ Time to celebrate our love, we're caught in it's ray of light\n♂ Calling to the world out loud, just let our spirits fly\nwe can write another page a golden age within our lifetime\n\nIt's the spirit of the night (spirit of the night)\nIt's the spirit of the night\nIt's the spirit of the night\nTakes our feelings so much higher\nAnd higher\n\nIt's the spirit of the night\nSpirit of the night\nBurning in our ecstasy\nSpirit of the night\nWe can live our fantasy",https://youtube.com/watch?v=UC7QzXPnt6k,https://www.youtube.com/watch?v=CXiQr2ew3lQ,00:00:55


2018,il,Israel,Netta Barzilai,Toy,1,1.0,22.0,7.0,1.0,529.0,1.0,283.0,317.0,212.0,116.0,167.0,Doron Medalie;Jack White;Stav Beger,Doron Medalie;Stav Beger,"Ree, ouch, he, hm, la\nRee, ouch, he, hm, la\nRee, ouch, he, hm, la\n\nRee, ouch, he, hm, la\nRee, ouch, he, hm, la\nRee, ouch, he, hm, la\n\nLook at me, I'm a beautiful creature\nI don't care 'bout your modern-time preachers\nWelcome boys, too much noise, I will teach ya\nDrum pam pa ooh, drum pam pa ooh\n\nHey, I think you forgot how to play\nMy teddy bear's running away\nThe Barbie got something to say: Hey! Hey! Hey! Hey!\nMy 'Simon says' leave me alone\nI'm taking my Pikachu home\nYou're stupid just like your smartphone\n\nWonder Woman don't you ever forget\nYou're divine and he's about to regret\nHe's a bucka-mhm-buck-buck-buck-mhm boy\nBucka-mhm-buck-buck-buck\nI'm not your bucka-mhm-buck-mhm-buck-mhm\n\nI'm not your toy (Not your toy)\nYou stupid boy (Stupid boy)\nI'll take you down\nI'll make you watch me\nDancing with my dolls\nOn the MadaBaka Beat\nNot your toy (Kulului kululuu. Kulului kululuu)\n\nAh ah, ah ah, ani lo buba\nDon't you go and play with me boy!\nAh ah, ah ah, ani lo buba\nDon't you go and play… Shake!\n\n(Kulului kululuu) Wedding bells ringing\n(Kulului kululuu) Money man bling-bling\nI don't care about your Stefa, baby\nDrum pam pa ooh, drum pam pa ooh\n\nWonder Woman don't you ever forget\nYou're divine and he's about to regret\nHe's a bucka-mhm-buck-buck-buck-mhm boy\nBucka-mhm-buck-buck-buck\nI'm not your bucka-mhm-buck-mhm-buck-mhm\n\nI'm not your toy (Not your toy)\nYou stupid boy (Stupid boy)\nI'll take you down\nI'll make you watch me\nDancing with my dolls\nOn the MadaBaka Beat\n\nI'll t-t-t-take you now\nW-w-w-with me now, boy\n\n(I'm not your toy)\nYou stupid boy\nI'll take you down\nI'll make you watch me\nDancing with my dolls\nOn the MadaBaka Beat\n\n(I'm not your toy) Look at me, I'm a beautiful creature\n(You stupid boy) I don't care about your modern time preachers\n(I'm not your toy) Not your toy, not your toy, not your toy, toy\nI'm not your toy, not your toy, not your toy, toy",https://youtube.com/watch?v=84LBjXaeKk4,https://www.youtube.com/watch?v=CziHrYYSyPc,00:01:10
