year,country_id,country,performer,song,place_contest,sf_num,running_final,running_sf,place_final,points_final,place_sf,points_sf,points_tele_final,points_jury_final,points_tele_sf,points_jury_sf,composers,lyricists,lyrics,youtube_url,youtube_url_studio,start
2013,by,Belarus,Alyona Lanskaya,Solayoh,16,1.0,8.0,11.0,16.0,48.0,7.0,64.0,,,,,Marc Paelinck,Martin King,"Friday night was going nowhere\nSitting in a small cafe\nFeeling lonely, a little tired\nI'd been working hard all day\n\nThen a noise caught my attention\nAnd I heard a wonderful sound\nComing at me like a tsunami\nNearly took my feet off the ground\n\nA rush of excitement brought you to my ears\nAll beautiful people aha-ia ia-ia-ia...\n\nSolayoh, Solayoh, where the sun is always shining on ya\nWe play-oh, we play-oh to the rhythm of a cha-cha\nSolayoh, Solayoh, turn the music up, it's gonna getcha\nWe play-oh, we play-oh, we can make it into a hot night (Yeah)\n\nSituation started improving\nMaybe this was kismet now\nAnd my body just started moving\nI was really shaking down\n\nSomething happened when I was dancing\nI could feel that powerful beat\nTaking me to new dimensions\nWaking up the devil in me\n\nA heavenly chorus and love all around\nAll beautiful people aha-ia ia-ia-ia...\n\nSolayoh, Solayoh, where the sun is always shining on ya\nWe play-oh, we play-oh to the rhythm of a cha-cha\nSolayoh, Solayoh, turn the music up, it's gonna getcha\nWe play-oh, we play-oh, we can make it into a hot night (Yeah)\n\nChacha, hey\nHey, hey...\n\nIt feels like I'm dreaming\nThis word makes no sense\nLet's sing it again now, ahey...\nSolay...\n\nSolayoh, Solayoh, where the sun is always shining on ya\nWe play-oh, we play-oh to the rhythm of a cha-cha\nSolayoh, Solayoh, turn the music up, it's gonna getcha\nWe play-oh, we play-oh, we can make it into a hot night\n\nSolayoh, Solayoh, turn the music up, it's gonna getcha\nWe play-oh, we play-oh, we can make it into a hot night\nWe can make it into a cha-cha",https://youtube.com/watch?v=XKewBfUE2Mg,https://www.youtube.com/watch?v=N4S4m9R-ffA,00:00:44
2013,is,Iceland,Eythor Ingi,Ég Á Líf,17,2.0,19.0,8.0,17.0,47.0,6.0,72.0,,,,,Örlygur Smári;Pétur Örn Guðmundsson,,"Lagði ég af stað í það langa ferðalag\nÉg áfram gekk í villu eirðarlaus\nHugsaði ekki um neitt, ekki fram á næsta dag\nEinveru og friðsemdina kaus\n\nÉg á líf, ég á líf yfir erfiðleika svíf\nÉg á líf, ég á líf vegna þín\nÞegar móti mér blæs yfir fjöllin há ég klíf\nÉg á líf, ég á líf, ég á líf vegna þín\n\nÉg skildi ekki ástina sem öllu hreyfir við\nÞorði ekki að faðma og vera til\nFannst sem ætti ekki skilið að opna huga minn\nOg hleypa bjartri ástinni þar inn\n\nÉg á líf, ég á líf yfir erfiðleika svíf\nÉg á líf, ég á líf vegna þín\nÞegar móti mér blæs yfir fjöllin há ég klíf\nÉg á líf, ég á líf vegna þín\n\nOg ég trúi því, já ég trúi því\nKannski opnast fagrar gáttir himins\nYfir flæðir fegursta ástin hún umvefur mig alein\n\nÉg á líf, (ég á líf) yfir erfiðleika svíf\nÉg á líf, (ég á líf) vegna þín\nÞegar móti mér blæs yfir fjöllin há ég klíf\nÉg á líf, ég á líf vegna þín\nÉg á líf, ég á líf, ég á líf",https://youtube.com/watch?v=GzE88IYzXLI,https://www.youtube.com/watch?v=PtunhyMW1hM,00:00:36
2013,am,Armenia,Dorians,Lonely Planet,18,2.0,12.0,11.0,18.0,41.0,7.0,69.0,,,,,Tony Iommi,Vardan Zadoyan,"Who's the one that starts a war?\nWho's dictating what is less and more?\nWho can change the night and day?\n\nWho's the one with clever face?\nThat can tell us what is in the space?\nPlaying games that none can play\n\nMaybe someday we'll break the wall\nMaybe the light will touch us all\n\nLonely planet, who has done it?\nWho can save you? Who can stop it?\nLonely planet, who has done it?\nWho can save you? Who can stop it?\n\nWho's the one that has the right?\nTreat us wrong and tell us what is right?\nBringing crowd against the squad\n\nWho has honesty to show?\nWho can tell us ""I don't know""?\nWho's the man and who's the god?\n\nMaybe someday we'll break the wall\nMaybe the light will touch us all\n\nLonely planet, who has done it?\nWho can save you? Who can stop it?\nLonely planet, who has done it?\nWho can save you? Who can stop it?\n\nLonely planet, we have done it\nWe can save you, we can stop it\nLonely planet, we have done it\nWe can save you, we can stop it\n\nWe can stop it, we can stop it\nWe can stop it, we can stop it\nFor the world",https://youtube.com/watch?v=UGOSZ7Uufno,https://www.youtube.com/watch?v=JSs03Sp-4ME,00:00:40
2013,gb,United Kingdom,Bonnie Tyler,Believe In Me,19,,15.0,,19.0,23.0,,,,,,,Christopher Braide;Desmond Child;Lauren Christy,,"You say you don't believe in signs from up above\nAnd you laugh at the thought of putting your faith in stuff like love\nYou never see the rainbow, you just curse the rain, you say\nYou wanna believe but it's just not worth the pain today\n\nBut that's all fine if that's how you want it to be\nBut if you're feeling alone and afraid and you can't breathe\n\nBelieve in me, yeah\nBelieve in me, yeah\n\nBelieve in the way I look at you and stand beside you\nThe way I speak the truth, I'd never lie to you\nIf you just believe in the things that your eyes can see\nBelieve in me\n\nYou come and you go and there's never no compromise, that's why\nThe seconds and the minutes of the days of your life go crawling by\nBut that's all fine if that's how you want it to be\nBut if you're feeling alone and afraid and you can't breathe\n\nBelieve in me, yeah\nBelieve in the way I look at you and stand beside you\nThe way I speak the truth, I'd never lie to you\nIf you just believe in the things that your eyes can see\nBelieve in me\n\nWhat ya gonna do when your ship is sinking?\nAnd you're crying out for help and just the seagull's listening\nIn the dark of the night, in the middle of the fight\nWhen you're reaching out for something and there's nothing\n\nBelieve in me, yeah\nBelieve in the way I look at you and stand beside you\nThe way I speak the truth, I'd never lie to you\nIf you just believe in the things that your eyes can see\nBelieve in me",https://youtube.com/watch?v=-agn-ERgTXA,https://www.youtube.com/watch?v=cqXk_FRw62Q,00:00:50
2013,ee,Estonia,Birgit,Et Uus Saaks Alguse,20,1.0,7.0,2.0,20.0,19.0,10.0,52.0,,,,,Mihkel Mattisen,Mihkel Mattisen;Silvia Soro,"Ma mäletan veel\nKui tuli mu hinge, et jääda, see tunne nii suur\nSamas nüüd seisan ma teel\nVaadates südame sisse, seal viliseb tuul\nAga tean, ma tean\nKõik võib muuta heaks\nIga uks, mis kord sulgub, see avaneb taas\n\nVeel sulab jää ja õide puhkeb raagus puu\nIga lõpp ei ole muud kui algus uus\nOn vaja ööd, et päev tooks valguse\nEt uus saaks alguse\nMis möödund, jäägu kaugele\nEt uus saaks taas alguse\n\nKardin avaneb taas\nOn algamas järgmine vaatus, kus tõusta saan maast\nSama hing, kuid uus mäng veel ees\nMuudetud saab minu saatus, saab uueks mu tee\nJa ma tean, ma tean\nKõik võib muuta heaks\nIga uks, mis kord sulgub, see avaneb taas\n\nVeel sulab jää ja õide puhkeb raagus puu\nIga lõpp ei ole muud kui algus uus\nOn vaja ööd, et päev tooks valguse\nEt uus saaks alguse\nMis möödund, jäägu kaugele\n\nVeel sulab jää ja õide puhkeb raagus puu\nIga lõpp ei ole muud kui algus uus\nOn vaja ööd, et päev tooks valguse\nEt uus saaks alguse\nMis möödund, jäägu kaugele\nEt uus saaks taas alguse",https://youtube.com/watch?v=Ooo6GvZNLhI,https://www.youtube.com/watch?v=oY98nV0MnUI,00:00:42
2013,de,Germany,Cascada,Glorious,21,,11.0,,21.0,18.0,,,,,,,Andres Ballinas;Manuel Reuter;Tony Cornelissen;Yann Peifer,,"(Glorious)\n\nDo you know it's time to let yourself go?\nWhy don't we just let it show?\nTell me what you're waiting for\n\n'Cause I, I wanna live before I die\nCrash and burn and lose my mind\nWe can set the world on fire\n\nTonight we can be glorious\nWe are young at heart and we're free\nThe world is ours, I can feel the music in me\nGlorious, found a love that eyes cannot see\nDelirious, hoo whoa... whoa...\n\nI believe the little child inside of me\nCan rebuild my destiny\nAnd one day I'll be breaking free\n\nNow's the time, we're running at the speed of light\nI'll meet you on the other side\nEvery time I close my eyes\n\nTonight we can be glorious\nWe are young at heart and we're free\nThe world is ours, I can feel the music in me\nGlorious, found a love that eyes cannot see\nDelirious, I can feel the music in me\n\n(Glorious) Found a love that eyes cannot see\n(Glorious)\n\n(We are glo... oh oh... oh oh oh...)\n(We are glo... oh oh... oh oh oh...)\n(We are glo... oh oh... oh oh oh...)\n(We are glo... oh oh... oh oh oh...)\n\nTonight we can be glorious\nWe are young at heart and we're free\nThe world is ours, I can feel the music in me\nGlorious, found a love that eyes cannot see\nDelirious,  hoo whoa... whoa...",https://youtube.com/watch?v=3HYTd7WDCPg,https://www.youtube.com/watch?v=EveTp7w1ucU,00:00:44
2013,lt,Lithuania,Andrius Pojavis,Something,22,1.0,2.0,10.0,22.0,17.0,9.0,53.0,,,,,Andrius Pojavis,,"I have to tell you something, it's been on my mind so long\nI've got to tell you this, it's been on my mind way too long\nI promised myself to tell\nInstead I'm falling apart to see you here\n\nIf you don't know, I'm in love with you\nWhen summertime falls, it becomes untrue\nBecause of my shoes I'm wearing today\nOne is called Love, the other is Pain, yeah...\n\nSo tell me now (So tell me now)\nI'm in your head (I'm in your head)\nI'm in your heart (I'm in your heart)\nTell me now (Tell me now)\n\nTell me now\nBecause I'm falling apart to see you here\n\nIf you don't know, I'm in love with you\nWhen summertime falls, it becomes untrue\nBecause of my shoes I'm wearing today\nOne is called Love, the other is Pain\n\nBut still you don't know, I'm in love with you\nWhen summertime falls, it becomes untrue\nBecause of my shoes I'm wearing today\nOne is called Love, the other is Pain\nOne is called Love, the other is Pain",https://youtube.com/watch?v=0VLhnzk_dAs,https://www.youtube.com/watch?v=8WwBxE8_hk4,00:00:45
2013,fr,France,Amandine Bourgeois,L'enfer Et Moi,23,,1.0,,23.0,14.0,,,,,,,David Salkin,Boris Bergman,"Tu m'as mise K.O. d'entrée\nIl faut croire que j'ai bien aimé\nLiens de cuir et mains de soie\n\nQui blesses-tu et dans quel port\nJusqu'à faire rougir l'aurore?\nTu m'as jeté comme un sort\n\nJe vais te faire l'enfer\nDe là où tu te perds\nRegarde bien derrière\nEt ce sera moi\n\nTu m'as fait pleurer à vif\nMon cou porte encore ta griffe\nJ'aimais échanger de peau\n\nNo limits, c'est un classique\nJ'aimais nos amours toxiques\nCelles qui font que tout est beau\n\nJe vais te faire l'enfer\nDe là où tu te perds\nRegarde bien derrière\n\nJe vais te faire l'enfer\nDe là où tu te perds\nRegarde bien derrière\nEt ce sera moi\n\nJe vais te faire l'enfer\nTu vas manquer d'air\nÀ moins une, à moins que\nOn s'retrouve à deux\nÀ moins qu'il nous faille\nRenoncer aux batailles\n\n(Je vais te faire l'enfer) J'vais te faire l'enfer\nTu vas manquer d'air (De là où tu te perds)\nÀ moins une, à moins que\nOn s'retrouve à deux (Regarde bien derrière)\nÀ moins qu'il nous faille\nRenoncer aux batailles\n\n(Je vais te faire l'enfer) J'vais te faire l'enfer\nTu vas manquer d'air  (De là où tu te perds)\nÀ moins une, à moins que\nOn s'retrouve à deux (Regarde bien derrière)\nÀ moins qu'il nous faille\nRenoncer\n\n(Je vais te faire l'enfer)",https://youtube.com/watch?v=hQwiQj5Dyj8,https://www.youtube.com/watch?v=YQJaab8j4fU,00:00:41
2013,fi,Finland,Krista Siegfrids,Marry Me,24,2.0,4.0,5.0,24.0,13.0,9.0,64.0,,,,,Erik Nyholm;Jessika Lundström;Krista Siegfrids;Kristofer Karlsson,,"Spying on you undercover, drinking coffee with your mother\nAm I getting closer?\nBaby, I feel like a sinner, skipping dinner to get thinner\nWhere is my proposal?\n\nI'm your slave and you're my master\nOh baby, come on, take a shot\n\nSo marry me, I'll be your queen bee\nI'll love you endlessly\nI'll do it for you, for you, for you\nYeah, I do'll it for you, marry me, baby\n\nI'll play your game, I'll change my last name\nI'll walk the walk of shame\nI'll do it for you, for you, for you\nYeah, I do'll it for you, marry me, baby\n\nOh oh, oh oh oh, ding dong\nOh oh, oh oh oh, ding dong\n\nI know where the future's heading, I can see my perfect wedding\nIsn't that just bracing?\nI don't think that I know ladies who will give you cuter babies\nIsn't that amazing?\n\nI'm your slave and you're my master\nOh baby, come on, take a shot\n\nSo marry me, I'll be your queen bee\nI love you endlessly\nI'll do it for you, for you, for you\nYeah, I do'll it for you, marry me, baby\n\nI'll play your game, I'll change my last name\nI'll walk the walk of shame\nI'll do it for you, for you, for you\nYeah, I do'll it for you, marry me, baby\n\nOh oh, oh oh oh, ding dong\nOh oh, oh oh oh, ding dong\nOh oh, oh oh oh oh oh, ding dong\nOh oh, oh oh oh, ding dong\n\nThis is the day, I don't wanna wait much longer now\nIf you run away, I'm gonna find you anyhow\nOh, yeah, yeah, oh yeah\nWhat ya waiting, what ya waiting\nWhat ya waiting, what ya waiting for?\n\nSo marry me, I'll be your queen bee\nI love you endlessly\nI'll do it for you, for you, for you\nYeah, I do'll it for you, marry me, baby\n\nI'll play your game, I'll change my last name\nI'll walk the walk of shame\nI'll do it for you, for you, for you\nYeah, I do'll it for you, marry me, baby\n\nOh oh, oh oh oh, ding dong\nOh oh, oh oh oh, ding dong\nOh oh, oh oh oh oh oh, ding dong\nOh oh, oh oh oh, ding dong",https://youtube.com/watch?v=dlBXOveVh7c,https://www.youtube.com/watch?v=bR3pKGRNexY,00:00:27
2013,es,Spain,ESDM,Contigo Hasta El Final (With You Until The End),25,,5.0,,25.0,8.0,,,,,,,David Feito;Juan Luis Suárez;Raquel del Rosario,,"Ah...\n\nUn cielo azul gana paso a la tormenta\nQue amenazó mi corazón\nY llegas tú, con todo lo que significas tú\nDescubriéndome quién soy\n\nEres esa luz que a través del universo\nTú me invitas a viajar contigo hasta el final\n\nLa ilusión de una vida por delante\nQue comienza justo hoy\nVámonos sin temor, gritemos que al final triunfó el amor\nQue ahora somos tú y yo\n\nEres esa luz que a través del universo\nTú me invitas a viajar, oh\nEres esa luz que a través del universo\nTú me invitas a viajar contigo hasta el final, oh yeah\nContigo hasta el final\n\nEres esa luz que a través del universo\nTú me invitas a viajar, oh\nEres esa luz que a través del universo\nTú me invitas a viajar contigo hasta el final, oh yeah\nContigo hasta el final, oh yeah\n\nContigo hasta el final",https://youtube.com/watch?v=5o_DnM_ANF8,https://www.youtube.com/watch?v=Q5m8aCZSvws,00:01:07
2013,ie,Ireland,Ryan Dolan,Only Love Survives,26,1.0,26.0,13.0,26.0,5.0,8.0,54.0,,,,,Ryan Dolan;Wez Devine,,"All our lives we've been afraid\nWatching the world decline till nothing remains\nBut in our darkest hour, right before the dawn\nThe old world dies, the new day is born\n\nWe're gonna live like it's our last night alive\nAnd we're dancing till the morning light\nAnd even if the sun don't rise\nIn the end, only love survives\n\nSo be love, be love\nJust be love (just be love), only love (only love)\nWe are love (we are love), only love (only love)\nAnd when the stars are aligned, you got to make love a state of mind\n'Cause in the end only love survives\n\nSo let the world collide, don't be afraid\nIf it's the end of time, love will remain\n\nTo live like it's the last night alive\nAnd we're dancing till the morning light\nAnd even if the sun don't rise\nIn the end, only love survives\n\nSo be love, be love\nJust be love (just be love), only love (only love)\nWe are love (we are love), only love (only love)\nAnd when the stars are aligned you got to make love a state of mind\n'Cause in the end, only love survives\n\nSo be love (be love), only love, love, love\n(Be love, only love) Only love, love, love\n('Cause in the end) Only love survives",https://youtube.com/watch?v=4tgtyl_5x5Y,https://www.youtube.com/watch?v=iGaZKoim43U,00:00:49
2013,Serbia,Serbia,Moje 3,Ljubav Je Svuda,27,1.0,,16.0,,,11.0,46.0,,,,,Saša Milošević Mare,Marina Tucaković,"Ljubav, ljubav ne postoji, kažu\nLažu, nemoj da se bojiš, kad on je tu\nLjubav za život ceo i posle još\nSa njim znaj biće to\n\nPitaću te ja za godinu dana\nKad te prevari na hiljadu strana\nSrce tvoje je tad ribama hrana\nZnaj\n\nJa k'o da sam luda\nMalo hoću, malo neću da verujem\nJer ne znam da l' smem\n\nDa, ljubav je svuda\nMalo volim, malo ne volim\nProbala bih svašta sa njim\n\nSanjaš, sanjaš svet u boji, plavoj\nSanjaš jer on je tvoj\nViše ne slušaj njegove laži\nKad te poljubi, reci mu važi, ti\n\nJa k'o da sam luda\nMalo hoću, malo neću da verujem\nJer ne znam da l' smem\n\nDa, ljubav je svuda\nMalo volim, malo ne volim\nProbala bih svašta sa njim\n\nTi čekala bi njega svaku noć do ujutru\nOn kuvaće ti kafu dok si još u krevetu\nVeruj mi, veruj sestro ja ti činim uslugu\nLalala lalala lalala...\n\nJa k'o da sam luda\nLjubav je svuda\n\nDa, ljubav je svuda\nMalo volim, malo ne volim\nProbala bih svašta sa njim\nI možda vešto još nešto",https://youtube.com/watch?v=DbAAFijZIxE,https://www.youtube.com/watch?v=LW7TAdytfww,00:00:53
2013,San Marino,San Marino,Valentina Monetta,Crisalide (Vola),28,2.0,,2.0,,,11.0,47.0,,,,,Ralph Siegel,Mauro Balestri,"Hu... mmm....\n\nCerte volte dentro me\nHo sentito un vuoto che\nMi chiamava dentro di sé\nVieni ora a vedere la verità\nC'è un ponte sull'immensità\n\nCosa sono in fondo io?\nSogno fragile di dio\nCon un corpo fatto così\nGrandi occhi colore, vivendo si muore\nRinnovati per l'eternità\n\nVola, vola, che la forza arriverà\nSempre sola verso un'altra libertà\nLa farfalla nuova lascia sempre giù\nLa crisalide che eri tu\nVuota senza me\n\nDalle nuvole si sa\nPoi la pioggia scenderà\nD'improvviso succederà\nLe ali bagnate di lacrime che non si asciugano\nPoi vento verrà\n\nE tu vola, vola, vola via da te\nSempre sola fino che un riflesso apparirà\nNello specchio che ruba l'immagine\nIn mille pezzi di vertigine\nE luce scintillerà\n\nQuanta vita c'è?\nNon me n'ero accorta mai\nE se ancora non lo sai\nL'universo siamo noi\n\nVola, che la forza arriverà\nMai più sola, nella vera libertà\nLa farfalla nuova lascia giù\nLa crisalide e di più\nVuota senza me\n\nVola, nella gioia sarai\nMai più sola nell'immensità di noi\nIn un attimo l'amore, come nuovo sole\nTutto cambierà\n\nVola, vola, vola insieme a me",https://youtube.com/watch?v=YirZIBi2vnY,https://www.youtube.com/watch?v=xi8mZ2ejLcE,00:01:04
2013,Bulgaria,Bulgaria,"Elitsa Todorova, Stoyan Yankulov",Samo Shampioni,29,2.0,,7.0,,,12.0,45.0,,,,,Christian Talev;Elitsa Todorova,,"Samo shampioni, samo shampioni\n\nPrelitat visoko i nadaleko\nskachat i se smeiat i sylzi se leat\nvsichkite yunatzi, te sa nai-dobrite\nsmeli v igrite, silni vyv dushite\n\nSamo divi, samo shampioni\nzlatni momtzi, momi za milioni\nima li mladi, ima li ludi\ntsialo selo doide\npeite, ne se bojte\n\nSamo shampioni, samo shampioni\n\nIma li mladi, ima li ludi\ntsialo selo doide, peite, ne se bojte\n\nЕ... а... а... а...\n\nSamo divi, samo shampioni\nzlatni momtzi, momi za milioni\nSamo divi, samo shampioni\nzlatni momtzi, momi za milioni\n\nSamo divi, samo shampioni\nzlatni momtzi, momi za milioni",https://youtube.com/watch?v=Cb46Mhy_mCI,https://www.youtube.com/watch?v=bExp3aNOFsE,00:00:45
2013,Montenegro,Montenegro,Who See,Igranka,30,1.0,,9.0,,,12.0,41.0,,,,,Đorđe Miljenović,Dejan Dedović;Đorđe Miljenović;Mario Đorđević,"Vodim te na igranku, na nanana igranku ku kukuku\nIgranku, vodim te na igranku\nVodim te na igranku, na nanana igranku ku kukuku\nIgranku, vodim te na igranku\n\nFešta je to, ne prestaje to, bit za bitom, vers za versom\nMrda se cio svijet s njom, jednim potezom i univerzum\n'Ajde vodi me, oslobodi me od gadnih stresova tokom godine\nNe mogu više da se paranojišem, na dobru feštu sve mi miriše\nIgranka bez prestanka vanka, na podijum ili pored sama šanka\nDan kad svane tu smo, nikad nije pustoš\nNišta nije frka samo treba uć' u štos\nKik i bas zaraza razara, niko neće poć' utvrđenog pazara\nOpet sjutra utabanim stazama, s mojima visim ne mislim o parama\n\nNek' traje cijelu noć i cijeli dan\nI biće još, biće još bolje, vjeruj mi\nJer mi smo stvoreni za to\nVodim te, vodim te, pođi za mnom ti\nPođi sa mnom sad\nOva noć je ta, ne vidi se kraj\nVodim te na igranku\n\nTreba mi fešta što neće prestat' dok ženska treska komad mesnat\nVrućina kao u rernu na dvjesta, odosmo s mozgom, stroboskop bljecka\nBit ko blesav po glavi šiba, pregore kesa, piće mi sipaj\nGradele, česan, petrusin, riba, danu svega da se pokidam\nI vodi me neđe da glavu produvam, neđe đe muzika dobro izuva\nPa da ne staje no samo da gruva, da svu noć traje i svi da su tuna\nPritisak trpi se, krpim se s mukom, vodi me neđe da baš ne bih puk'o\nNačinjem limenku, život je čudo, 'ajmo na igranku, đe ćemo drugo?\n\nNek' traje cijelu noć i cijeli dan\nI biće još, biće još bolje, vjeruj mi\nJer mi smo stvoreni za to\nVodim te, vodim te, pođi za mnom ti\nPođi sa mnom sad\nOva noć je ta, ne vidi se kraj\nVodim te na igranku\n\nSamo nek' bit udara, svi su mi ođe banja\nI nije bitno to što svima je novčanik tanak\nSamo nek' bit udara, svi su mi ođe banja\nBurgija vrti vazda tamo đe ne vrti para\n\nVodim te na igranku, na nanana igranku ku kukuku\nIgranku, vodim te na igranku\nVodim te na igranku, na nanana igranku ku kukuku\nIgranku, vodim te na igranku",https://youtube.com/watch?v=FR9rtB2ilZU,https://www.youtube.com/watch?v=8BmHI_57vJk,00:00:41
2013,Switzerland,Switzerland,Takasa,You And Me,31,2.0,,16.0,,,13.0,41.0,,,,,Georg Schlunegger,,"When the times are getting rough, gold and silver turn to dust\nPeople build their barricades out of jealousy and hate\nBut there's one thing they could never, never ever separate\n\nAh... let it hear from near and far\nThis is how it's meant to be, we're together, you and me\nAh... nothing can tear us apart\nSailing on a stormy sea, we're together, you and me\n\nWe build castles with our hands, on a solid ground they stand\nThey're our shelter from the storm, keep us safe and keep us warm\nNo, there's nothing that can hurt us, whatever there may come\n\nAh... let it hear from near and far\nThis is how it's meant to be, we're together, you and me\nAh... nothing can tear us apart\nSailing on a stormy sea, we're together, you and me\n\nTime is flowing to the sea, but it's still you and me\nNothing's like it used to be, but we're here, you and me\n\nAh... let it hear from near and far\nThis is how it's meant to be, we're together, you and me\nAh... nothing can tear us apart\nSailing on a stormy sea, we're together, you and me\n\nAh, nothing can tear us apart\nSailing on a stormy sea, we're together, you and me",https://youtube.com/watch?v=Ba6ovg4yAto,https://www.youtube.com/watch?v=fBGpqq2LFSQ,00:00:31
2013,Croatia,Croatia,Klapa s mora,Mižerja,32,1.0,,4.0,,,13.0,38.0,,,,,Goran Topolovac,,"Zlata niman da te njime okitim\nSamo ove ruke dvi da ti dušu zagrlim\n\nEj mižerja, ka tvrda si stina\nEj mižerja, ka dvi kapi vina\nNemam ništa, samo viru\nI bokun čiste jubavi\n\nEj mižerja, ka tvrda si stina\nEj mižerja, ka dvi kapi vina\nNemam ništa, samo viru\nI bokun čiste jubavi\n\nRužo moja lipa za te živit ću\nI zadnju koru suvog kruva s tobom dilit ću\n\nEj mižerja, ka tvrda si stina\nEj mižerja, ka dvi kapi vina\nNemam ništa, samo viru\nI bokun čiste jubavi\n\nEj mižerja, ka tvrda si stina\nEj mižerja, mižerja, mižerja\n\nEj mižerja, ka tvrda si stina\nEj mižerja, ka dvi kapi vina\nNemam ništa, samo viru\nI bokun čiste jubavi\n\nJa nemam ništa, samo viru\nI bokun čiste jubavi\n(Mižerja)",https://youtube.com/watch?v=FYm4sGd-qP0,https://www.youtube.com/watch?v=UuEcT_SzfuQ,00:00:52
2013,Israel,Israel,Moran Mazor,Rak Bishvilo,33,2.0,,10.0,,,14.0,40.0,,,,,Chen Harari,Gal Sarig,"Shuv baleilot otser hageshem tipotav\nOd menasa lignov chiuch mibein sfatav\nKama shtikot omrot vechama mastirot\nKama emet notra bein kol hatehiot\n\nRak bishvilo uchal lishkoach et hakor\nUvizchuto emtsa bachoshech et ha'or\nRak bishvilo elech, echtse et hagvulot\nRak ito eda tshuvot lashe'elot\n\nRak bishvilo uchal lishkoach et hakor\nUvizchuto emtsa bachoshech et ha'or\nRak bishvilo elech, echtse et hagvulot\nRak ito eda tshuvot lashe'elot\n\nShuv bayamim eshmor mabat cham ve'otef\nOd menasa panav besheket lelatef\nKama dma'ot chalfu vechama nish'aru\nKama tikvot nivnu vechama nishberu\n\nRak bishvilo uchal lishkoach et hakor\nUvizchuto emtsa bachoshech et ha'or\nRak bishvilo elech, echtse et hagvulot\nRak ito eda tshuvot lashe'elot\n\nRak bishvilo uchal lishkoach et hakor\nUvizchuto emtsa bachoshech et ha'or\nRak bishvilo elech, echtse et hagvulot\nRak ito eda tshuvot lashe'elot\n\n(Shuv bayamim eshmor mabat cham ve'otef)\nOd menasa panav besheket lelatef\n\nRak bishvilo uchal lishkoach et hakor\nUvizchuto emtsa bachoshech et ha'or\nRak bishvilo elech, echtse et hagvulot\nRak ito eda tshuvot lashe'elot\n\nRak bishvilo uchal lishkoach et hakor\nUvizchuto emtsa bachoshech et ha'or\nRak bishvilo elech, echtse et hagvulot\nRak ito eda tshuvot lashe'elot",https://youtube.com/watch?v=BjbcD72OaI4,https://www.youtube.com/watch?v=QMyAgBetY4A,00:00:46
